paragraph,stemmed,tokenized
"REMOVAL OF DEBRIS AND VOLCANIC ASH
We will pay reasonable expenses actually
incurred by you in the removal of
a debris of covered property provided the
loss to the property is from a cause of loss
identified under WHAT LOSSES ARE
COVERED  SECTION I as applicable to
the property or
b that portion of volcanic ash dust or
particulate matter that has caused direct
loss to a building or to property contained
in a building covered under SECTION I",remov of debri and volcan ash we will pay reason expens actual incur by you in the remov of a debri of cover properti provid the loss to the properti is from a caus of loss identifi under what loss are cover section i as applic to the properti or b that portion of volcan ash dust or particul matter that has caus direct loss to a build or to properti contain in a build cover under section i,"removal of DEBRIS and VOLCANIC ASH 
 we will pay reasonable expense actually 
 incur by you in the removal of 
 a debris of covered property provide the 
 loss to the property be from a cause of loss 
 identify under what loss be 
 COVERED   SECTION I as applicable to 
 the property or 
 b that portion of volcanic ash dust or 
 particulate matter that have cause direct 
 loss to a building or to property contain 
 in a building cover under section I"
"The expense for the removal of debris and
volcanic ash is included in the amount of the
limit of liability applying to the damaged
property When the amount payable for the
actual damage to the property plus the
expense for the removal of debris and volcanic
ash exceeds the amount of the limit of liability
for the damaged property an additional 5 of
the amount of that limit of liability will be
available to cover the expense of removing
debris and volcanic ash
One or more volcanic eruptions that occur
within a 168 hour period will be considered as
one volcanic eruption",the expens for the remov of debri and volcan ash is includ in the amount of the limit of liabil appli to the damag properti when the amount payabl for the actual damag to the properti plus the expens for the remov of debri and volcan ash exceed the amount of the limit of liabil for the damag properti an addit 5 of the amount of that limit of liabil will be avail to cover the expens of remov debri and volcan ash one or more volcan erupt that occur within a 168 hour period will be consid as one volcan erupt,"the expense for the removal of debris and 
 volcanic ash be include in the amount of the 
 limit of liability apply to the damage 
 property when the amount payable for the 
 actual damage to the property plus the 
 expense for the removal of debris and volcanic 
 ash exceed the amount of the limit of liability 
 for the damage property an additional 5 of 
 the amount of that limit of liability will be 
 available to cover the expense of remove 
 debris and volcanic ash 
 one or more volcanic eruption that occur 
 within a 168 hour period will be consider as 
 one volcanic eruption"
"REASONABLE EMERGENCY MEASURES
We will pay reasonable expenses actually
incurred by you for necessary emergency
measures taken solely to protect covered
property from further damage after a loss
covered under SECTION I If this involves
repair to property other than the property to be
protected we will pay only for the repair of
other property that is covered under SECTION
I and damaged by a cause of loss covered
under SECTION I
This coverage
a Does not increase the limit of liability that
applies to the covered property
b Does not relieve you of your duties in
case of a loss to covered property as set
forth in provision 4b of CONDITIONS –
SECTION I",reason emerg measur we will pay reason expens actual incur by you for necessari emerg measur taken sole to protect cover properti from further damag after a loss cover under section i if this involv repair to properti other than the properti to be protect we will pay onli for the repair of other properti that is cover under section i and damag by a caus of loss cover under section i this coverag a doe not increas the limit of liabil that appli to the cover properti b doe not reliev you of your duti in case of a loss to cover properti as set forth in provis 4b of condit – section i,"REASONABLE EMERGENCY MEASURES 
 we will pay reasonable expense actually 
 incur by you for necessary emergency 
 measure take solely to protect cover 
 property from further damage after a loss 
 cover under section I if this involve 
 repair to property other than the property to be 
 protect we will pay only for the repair of 
 other property that be cover under SECTION 
 I and damage by a cause of loss cover 
 under SECTION i 
 this coverage 
 a do not increase the limit of liability that 
 apply to the covered property 
 b do not relieve you of your duty in 
 case of a loss to cover property as set 
 forth in provision 4b of condition – 
 section I"
"PROPERTY REMOVED
We insure covered property against direct loss
from any cause while being removed from a
premises endangered by a cause of loss
identified under WHAT LOSSES ARE
COVERED – SECTION I and for no more than
30 days while removed This coverage does
not change the limit of liability that applies to
the property being removed",properti remov we insur cover properti against direct loss from ani caus while be remov from a premis endang by a caus of loss identifi under what loss are cover – section i and for no more than 30 day while remov this coverag doe not chang the limit of liabil that appli to the properti be remov,"property remove 
 we insure cover property against direct loss 
 from any cause while be remove from a 
 premise endanger by a cause of loss 
 identify under what loss be 
 covered – section I and for no more than 
 30 day while remove this coverage do 
 not change the limit of liability that apply to 
 the property be remove"
"REFRIGERATED FOOD SPOILAGE
We will pay up to 500 in the aggregate per
policy period for damage to or spoilage of
perishable foods owned by any insured and
kept in a refrigerator or freezer located on the
residence premises if the loss results from
a interruption of power to the refrigerator or
freezer caused by damage to or failure of
the generating or transmitting equipment
or
b mechanical breakdown of the refrigerator
or freezer
This coverage
a is voided by the negligence of any insured
in
20",refriger food spoilag we will pay up to 500 in the aggreg per polici period for damag to or spoilag of perish food own by ani insur and kept in a refriger or freezer locat on the resid premis if the loss result from a interrupt of power to the refriger or freezer caus by damag to or failur of the generat or transmit equip or b mechan breakdown of the refriger or freezer this coverag a is void by the neglig of ani insur in 20,"refrigerate food SPOILAGE 
 we will pay up to 500 in the aggregate per 
 policy period for damage to or spoilage of 
 perishable food own by any insured and 
 keep in a refrigerator or freezer locate on the 
 residence premise if the loss result from 
 a interruption of power to the refrigerator or 
 freezer cause by damage to or failure of 
 the generate or transmit equipment 
 or 
 b mechanical breakdown of the refrigerator 
 or freezer 
 this coverage 
 a be void by the negligence of any insure 
 in 
 20"
"1 maintaining
a the refrigerator or freezer in
working condition or
b the supply of electricity to the
refrigerator or freezer and
2 protecting food after a known loss and
b does not increase the limit of liability of
COVERAGE C
No deductible applies to this coverage
10",1 maintain a the refriger or freezer in work condit or b the suppli of electr to the refriger or freezer and 2 protect food after a known loss and b doe not increas the limit of liabil of coverag c no deduct appli to this coverag 10,"1 maintain 
 a the refrigerator or freezer in 
 working condition or 
 b the supply of electricity to the 
 refrigerator or freezer and 
 2 protect food after a know loss and 
 b do not increase the limit of liability of 
 COVERAGE c 
 no deductible apply to this coverage 
 10"
"CREDIT CARD FUND TRANSFER CARD
FORGERY AND COUNTERFEIT MONEY
We will pay up to 500 for
a the legal obligation of any insured to pay
because of the theft or unauthorized use of
any credit card issued to or registered in
any insureds name
b loss resulting from the theft or
unauthorized use of any fund transfer card
used for deposit withdrawal or transfer of
funds issued to or registered in any
insureds name
c loss to any insured caused by the forgery
or alteration of that insureds check or
other negotiable instrument or
d loss to any insured through acceptance in
good faith of counterfeit United States or
Canadian paper currency",credit card fund transfer card forgeri and counterfeit money we will pay up to 500 for a the legal oblig of ani insur to pay becaus of the theft or unauthor use of ani credit card issu to or regist in ani insur name b loss result from the theft or unauthor use of ani fund transfer card use for deposit withdraw or transfer of fund issu to or regist in ani insur name c loss to ani insur caus by the forgeri or alter of that insur check or other negoti instrument or d loss to ani insur through accept in good faith of counterfeit unit state or canadian paper currenc,"CREDIT card FUND TRANSFER card 
 forgery and counterfeit money 
 we will pay up to 500 for 
 a the legal obligation of any insure to pay 
 because of the theft or unauthorized use of 
 any credit card issue to or register in 
 any insured name 
 b loss result from the theft or 
 unauthorized use of any fund transfer card 
 use for deposit withdrawal or transfer of 
 fund issue to or register in any 
 insured name 
 c loss to any insure cause by the forgery 
 or alteration of that insured check or 
 other negotiable instrument or 
 d loss to any insure through acceptance in 
 good faith of counterfeit United States or 
 canadian paper currency"
"All loss resulting from a series of acts
committed by any one person or in which any
one person is concerned or implicated is
considered to be one loss
We do not cover
a the theft or unauthorized use of any credit
or fund transfer card by
1 an insured or any other regular
resident of the residence premises
2 any person who has been entrusted
with the credit or fund transfer card or
3 any person if any insured has not
complied with all terms and conditions
under which the credit or fund transfer
card is issued
21",all loss result from a seri of act commit by ani one person or in which ani one person is concern or implic is consid to be one loss we do not cover a the theft or unauthor use of ani credit or fund transfer card by 1 an insur or ani other regular resid of the resid premis 2 ani person who has been entrust with the credit or fund transfer card or 3 ani person if ani insur has not compli with all term and condit under which the credit or fund transfer card is issu 21,"all loss result from a series of act 
 commit by any one person or in which any 
 one person be concern or implicate be 
 consider to be one loss 
 we do not cover 
 a the theft or unauthorized use of any credit 
 or fund transfer card by 
 1 an insured or any other regular 
 resident of the residence premise 
 2 any person who have be entrust 
 with the credit or fund transfer card or 
 3 any person if any insure have not 
 comply with all term and condition 
 under which the credit or fund transfer 
 card be issue 
 21"
"b loss to any insured caused by the forgery
or alteration of any insureds check or
other negotiable instrument by an insured
or any other occupant of the residence
premises
c loss to any insured caused by any
insureds acceptance of any check or
other negotiable instrument that has been
altered or forged or that is dishonored by
the financial institution upon which it is
drawn or
d loss arising out of the business or
dishonesty of any insured",b loss to ani insur caus by the forgeri or alter of ani insur check or other negoti instrument by an insur or ani other occup of the resid premis c loss to ani insur caus by ani insur accept of ani check or other negoti instrument that has been alter or forg or that is dishonor by the financi institut upon which it is drawn or d loss aris out of the busi or dishonesti of ani insur,"b loss to any insure cause by the forgery 
 or alteration of any insured check or 
 other negotiable instrument by an insure 
 or any other occupant of the residence 
 premise 
 c loss to any insure cause by any 
 insured acceptance of any check or 
 other negotiable instrument that have be 
 alter or forge or that be dishonor by 
 the financial institution upon which it be 
 draw or 
 d loss arise out of the business or 
 dishonesty of any insure"
"If a suit is brought
a against any insured for liability under the
CREDIT CARD or FUND TRANSFER
CARD coverage we will provide a defense
at our expense by lawyers of our choice
and
b for the enforcement of payment under the
FORGERY coverage we have the option
to defend at our expense an insured or
an insureds financial institution",if a suit is brought a against ani insur for liabil under the credit card or fund transfer card coverag we will provid a defens at our expens by lawyer of our choic and b for the enforc of payment under the forgeri coverag we have the option to defend at our expens an insur or an insur financi institut,"if a suit be bring 
 a against any insured for liability under the 
 CREDIT CARD or FUND TRANSFER 
 card coverage we will provide a defense 
 at our expense by lawyer of our choice 
 and 
 b for the enforcement of payment under the 
 forgery coverage we have the option 
 to defend at our expense an insured or 
 an insured financial institution"
"We may make settlement of any claim or
lawsuit as we think appropriate Our obligation
to defend any claim or suit ends when the
amount we pay for the loss equals our limit of
liability
This coverage is additional insurance No
deductible applies to this coverage
11",we may make settlement of ani claim or lawsuit as we think appropri our oblig to defend ani claim or suit end when the amount we pay for the loss equal our limit of liabil this coverag is addit insur no deduct appli to this coverag 11,"we may make settlement of any claim or 
 lawsuit as we think appropriate our obligation 
 to defend any claim or suit end when the 
 amount we pay for the loss equal our limit of 
 liability 
 this coverage be additional insurance no 
 deductible apply to this coverage 
 11"
"ABRUPT COLLAPSE
We will cover property insured under SECTION
I against accidental direct physical loss from
the abrupt collapse of a building or part of a
building if caused by or resulting from
a any cause of loss identified under WHAT
LOSSES ARE COVERED – SECTION I
b weight of ice snow or sleet or weight of
rain which collects on a roof
c decay of a building or any part of a
building that is hidden from view unless",abrupt collaps we will cover properti insur under section i against accident direct physic loss from the abrupt collaps of a build or part of a build if caus by or result from a ani caus of loss identifi under what loss are cover – section i b weight of ice snow or sleet or weight of rain which collect on a roof c decay of a build or ani part of a build that is hidden from view unless,"abrupt collapse 
 we will cover property insure under SECTION 
 I against accidental direct physical loss from 
 the abrupt collapse of a building or part of a 
 building if cause by or result from 
 a any cause of loss identify under what 
 loss be covered – section I 
 b weight of ice snow or sleet or weight of 
 rain which collect on a roof 
 c decay of a building or any part of a 
 building that be hide from view unless"
"the presence of such decay is known to an
insured prior to the abrupt collapse
d insect or vermin damage to a building or
any part of a building that is hidden from
view unless the presence of such damage
is known to an insured prior to the abrupt
collapse
e weight of contents equipment people or
animals or
f use of defective materials or methods in
construction
repair
remodeling
or
renovation if the abrupt collapse occurs
during the construction repair remodeling
or renovation",the presenc of such decay is known to an insur prior to the abrupt collaps d insect or vermin damag to a build or ani part of a build that is hidden from view unless the presenc of such damag is known to an insur prior to the abrupt collaps e weight of content equip peopl or anim or f use of defect materi or method in construct repair remodel or renov if the abrupt collaps occur dure the construct repair remodel or renov,"the presence of such decay be know to an 
 insure prior to the abrupt collapse 
 d insect or vermin damage to a building or 
 any part of a building that be hide from 
 view unless the presence of such damage 
 be know to an insured prior to the abrupt 
 collapse 
 e weight of content equipment people or 
 animal or 
 f use of defective material or method in 
 construction 
 repair 
 remodel 
 or 
 renovation if the abrupt collapse occur 
 during the construction repair remodel 
 or renovation"
"Abrupt collapse means the abrupt falling down
or caving in of a building or any part of a
building with the result that the building or part
of the building cannot be occupied for its
intended purpose",abrupt collaps mean the abrupt fall down or cave in of a build or ani part of a build with the result that the build or part of the build cannot be occupi for it intend purpos,"abrupt collapse mean the abrupt fall down 
 or cave in of a building or any part of a 
 building with the result that the building or part 
 of the building can not be occupy for its 
 intend purpose"
"Abrupt collapse does not apply to
a a building or any part of a building that is
merely in danger of abrupt collapse
b a part of a building that is standing even if
it has separated from another part of the
building or
c a building or any part of a building that is
standing even if it shows evidence of
collapse cracking bulging sagging
bending leaning settling shrinkage or
expansions",abrupt collaps doe not appli to a a build or ani part of a build that is mere in danger of abrupt collaps b a part of a build that is stand even if it has separ from anoth part of the build or c a build or ani part of a build that is stand even if it show evid of collaps crack bulg sag bend lean settl shrinkag or expans,"abrupt collapse do not apply to 
 a a building or any part of a building that be 
 merely in danger of abrupt collapse 
 b a part of a building that be stand even if 
 it have separate from another part of the 
 building or 
 c a building or any part of a building that be 
 stand even if it show evidence of 
 collapse crack bulging sag 
 bend lean settle shrinkage or 
 expansion"
"Loss to an awning fence patio driveway or
walkway spa swimming pool pond
underground pipe flue drain cesspool septic
tank foundation retaining wall pier bulkhead
wharf or dock all whether or not attached to
the dwelling or any other building on the
residence premises is not covered unless the
loss is a direct result of the abrupt collapse of a
building or any part of it
This coverage does not increase the amount of
the limit of liability applicable to the property
damaged or destroyed by abrupt collapse This
23",loss to an awn fenc patio driveway or walkway spa swim pool pond underground pipe flue drain cesspool septic tank foundat retain wall pier bulkhead wharf or dock all whether or not attach to the dwell or ani other build on the resid premis is not cover unless the loss is a direct result of the abrupt collaps of a build or ani part of it this coverag doe not increas the amount of the limit of liabil applic to the properti damag or destroy by abrupt collaps this 23,"loss to an awning fence patio driveway or 
 walkway spa swimming pool pond 
 underground pipe flue drain cesspool septic 
 tank foundation retain wall pier bulkhead 
 wharf or dock all whether or not attach to 
 the dwelling or any other building on the 
 residence premise be not cover unless the 
 loss be a direct result of the abrupt collapse of a 
 building or any part of it 
 this coverage do not increase the amount of 
 the limit of liability applicable to the property 
 damage or destroy by abrupt collapse this 
 23"
"FUNGI WET OR DRY ROT OR BACTERIA
If a loss caused by a cause of loss identified
under WHAT LOSSES ARE COVERED –
SECTION I results in fungi wet or dry rot or
bacteria we will pay for
a remediation of the fungi wet or dry rot or
bacteria This includes payment for the
reasonable and necessary cost to
1 remove the fungi wet or dry rot or
bacteria from covered property or to
repair restore or replace that property
and
2 tear out and replace any part of the
building as needed to gain access to
the fungi wet or dry rot or bacteria
b any reasonable and necessary increase in
living expense you incur so that your
household can maintain its normal
standard of living or loss of fair rental value
if the fungi wet or dry rot or bacteria
makes the residence premises not fit to
live in We do not cover loss or expense
due to cancellation of a lease or
agreement and
c any reasonable and necessary testing or
monitoring of air or property to confirm the
absence presence or level of the fungi
wet or dry rot or bacteria whether
performed prior to during or after removal
repair restoration or replacement The cost
of such testing will be provided only to the
extent that there is reason to believe that
there is the presence of fungi wet or dry
rot or bacteria",fungi wet or dri rot or bacteria if a loss caus by a caus of loss identifi under what loss are cover – section i result in fungi wet or dri rot or bacteria we will pay for a remedi of the fungi wet or dri rot or bacteria this includ payment for the reason and necessari cost to 1 remov the fungi wet or dri rot or bacteria from cover properti or to repair restor or replac that properti and 2 tear out and replac ani part of the build as need to gain access to the fungi wet or dri rot or bacteria b ani reason and necessari increas in live expens you incur so that your household can maintain it normal standard of live or loss of fair rental valu if the fungi wet or dri rot or bacteria make the resid premis not fit to live in we do not cover loss or expens due to cancel of a leas or agreement and c ani reason and necessari test or monitor of air or properti to confirm the absenc presenc or level of the fungi wet or dri rot or bacteria whether perform prior to dure or after remov repair restor or replac the cost of such test will be provid onli to the extent that there is reason to believ that there is the presenc of fungi wet or dri rot or bacteria,"FUNGI WET or DRY ROT OR BACTERIA 
 if a loss cause by a cause of loss identify 
 under what loss be covered – 
 section I result in fungus wet or dry rot or 
 bacteria we will pay for 
 a remediation of the fungus wet or dry rot or 
 bacteria this include payment for the 
 reasonable and necessary cost to 
 1 remove the fungus wet or dry rot or 
 bacteria from cover property or to 
 repair restore or replace that property 
 and 
 2 tear out and replace any part of the 
 building as need to gain access to 
 the fungus wet or dry rot or bacteria 
 b any reasonable and necessary increase in 
 living expense you incur so that your 
 household can maintain its normal 
 standard of living or loss of fair rental value 
 if the fungus wet or dry rot or bacteria 
 make the residence premise not fit to 
 live in we do not cover loss or expense 
 due to cancellation of a lease or 
 agreement and 
 c any reasonable and necessary testing or 
 monitoring of air or property to confirm the 
 absence presence or level of the fungus 
 wet or dry rot or bacteria whether 
 perform prior to during or after removal 
 repair restoration or replacement the cost 
 of such testing will be provide only to the 
 extent that there be reason to believe that 
 there be the presence of fungus wet or dry 
 rot or bacteria"
"We will pay under this additional coverage only
if
a the covered loss occurs during the policy
period
b all reasonable means were used to save
and preserve the property at the time of
and after the covered loss and",we will pay under this addit coverag onli if a the cover loss occur dure the polici period b all reason mean were use to save and preserv the properti at the time of and after the cover loss and,"we will pay under this additional coverage only 
 if 
 a the covered loss occur during the policy 
 period 
 b all reasonable mean be use to save 
 and preserve the property at the time of 
 and after the covered loss and"
