paragraph,stemmed,tokenized
"It is your duty however to select and maintain
adequate amounts of insurance
Any adjustment in the limits of liability listed
above do not in any way represent warrant
or guarantee that these adjustments will
accurately account for inflation or that the
amounts of coverage are adequate to repair or
replace the damaged or destroyed property
49",it is your duti howev to select and maintain adequ amount of insur ani adjust in the limit of liabil list abov do not in ani way repres warrant or guarante that these adjust will accur account for inflat or that the amount of coverag are adequ to repair or replac the damag or destroy properti 49,"it be your duty however to select and maintain 
 adequate amount of insurance 
 any adjustment in the limit of liability list 
 above do not in any way represent warrant 
 or guarantee that these adjustment will 
 accurately account for inflation or that the 
 amount of coverage be adequate to repair or 
 replace the damage or destroy property 
 49"
"SECTION II – LIABILITY COVERAGES
COVERAGE E – PERSONAL LIABILITY
COVERAGE F – MEDICAL PAYMENTS TO
OTHERS
WHAT LOSSES ARE COVERED – COVERAGE E
1",section ii – liabil coverag coverag e – person liabil coverag f – medic payment to other what loss are cover – coverag e 1,"SECTION II – LIABILITY coverage 
 coverage e – PERSONAL LIABILITY 
 COVERAGE F – MEDICAL payment to 
 other 
 what loss be covered – coverage e 
 1"
"We will pay for actual damages that any
insured is legally obligated to pay due to
bodily injury or property damage caused by
an occurrence to which this coverage applies",we will pay for actual damag that ani insur is legal oblig to pay due to bodili injuri or properti damag caus by an occurr to which this coverag appli,"we will pay for actual damage that any 
 insure be legally obligate to pay due to 
 bodily injury or property damage cause by 
 an occurrence to which this coverage apply"
"Damages do not include
a fines
b penalties
c restitution orders or
d attorney’s fees or costs or
e punitive damages",damag do not includ a fine b penalti c restitut order or d attorney fee or cost or e punit damag,"damage do not include 
 a fine 
 b penalty 
 c restitution order or 
 d attorney ’s fee or cost or 
 e punitive damage"
"We will defend any suit claiming damages for
bodily injury or property damage to which
this coverage applies We will defend suit even
if the allegations are groundless false or
fraudulent Defense lawyers will be provided by
us We may pay the lawyer a flat fee to
represent you If any insured retains a lawyer
for any claim whether or not covered under
this coverage we will not pay the fees and
costs charged by that lawyer Our duty to
defend ends when the amount we pay for
damages resulting from one occurrence
equals our limit of liability including depositing
funds into the court We have no duty to defend
any insured in any criminal action or
proceeding in which the recovery of a fine
penalty or restitution is sought",we will defend ani suit claim damag for bodili injuri or properti damag to which this coverag appli we will defend suit even if the alleg are groundless fals or fraudul defens lawyer will be provid by us we may pay the lawyer a flat fee to repres you if ani insur retain a lawyer for ani claim whether or not cover under this coverag we will not pay the fee and cost charg by that lawyer our duti to defend end when the amount we pay for damag result from one occurr equal our limit of liabil includ deposit fund into the court we have no duti to defend ani insur in ani crimin action or proceed in which the recoveri of a fine penalti or restitut is sought,"we will defend any suit claim damage for 
 bodily injury or property damage to which 
 this coverage apply we will defend suit even 
 if the allegation be groundless false or 
 fraudulent Defense lawyer will be provide by 
 we we may pay the lawyer a flat fee to 
 represent you if any insured retain a lawyer 
 for any claim whether or not cover under 
 this coverage we will not pay the fee and 
 cost charge by that lawyer our duty to 
 defend end when the amount we pay for 
 damage result from one occurrence 
 equal our limit of liability include deposit 
 fund into the court we have no duty to defend 
 any insure in any criminal action or 
 proceeding in which the recovery of a fine 
 penalty or restitution be seek"
"WHAT LOSSES ARE COVERED – COVERAGE F
We will pay reasonable expenses actually incurred
for necessary medical and funeral services because
of bodily injury sustained as a result of an accident
50",what loss are cover – coverag f we will pay reason expens actual incur for necessari medic and funer servic becaus of bodili injuri sustain as a result of an accid 50,"what loss be covered – COVERAGE f 
 we will pay reasonable expense actually incur 
 for necessary medical and funeral service because 
 of bodily injury sustain as a result of an accident 
 50"
"to which this coverage applies We will pay only for
services actually incurred and reported to us within 3
years from the accident date This coverage does not
apply to you or regular residents of your household
except residence employees
This coverage applies to
1",to which this coverag appli we will pay onli for servic actual incur and report to us within 3 year from the accid date this coverag doe not appli to you or regular resid of your household except resid employe this coverag appli to 1,"to which this coverage apply we will pay only for 
 service actually incur and report to we within 3 
 year from the accident date this coverage do not 
 apply to you or regular resident of your household 
 except residence employee 
 this coverage apply to 
 1"
"persons off an insured location if the bodily
injury
a arises out of a condition on an insured
location or the ways immediately
adjoining
b is caused by the activities of any insured
c is caused by a residence employee in the
course of that residence employees
employment by any insured or
d is caused by an animal owned by or in the
care or custody of any insured except any
animal that is excluded under 1n of
WHAT LOSSES ARE NOT COVERED –
EXCLUSIONS  SECTION II",person off an insur locat if the bodili injuri a aris out of a condit on an insur locat or the way immedi adjoin b is caus by the activ of ani insur c is caus by a resid employe in the cours of that resid employe employ by ani insur or d is caus by an anim own by or in the care or custodi of ani insur except ani anim that is exclud under 1n of what loss are not cover – exclus section ii,"person off an insured location if the bodily 
 injury 
 a arise out of a condition on an insure 
 location or the way immediately 
 adjoin 
 b be cause by the activity of any insure 
 c be cause by a residence employee in the 
 course of that residence employee 
 employment by any insured or 
 d be cause by an animal own by or in the 
 care or custody of any insure except any 
 animal that be exclude under 1n of 
 what loss be not covered – 
 exclusion   section ii"
"Under SECTION II we do not cover
a Bodily injury or property damage arising
out of
1 Intentional
acts
or
omissions
committed by or at the direction of any
insured that could reasonably be
expected or intended by an insured to
result in bodily injury or property
damage even if the bodily injury or
property damage
a is of a different kind quality or
degree than expected or intended
or
b is sustained by a different person
or entity than expected or
intended",under section ii we do not cover a bodili injuri or properti damag aris out of 1 intent act or omiss commit by or at the direct of ani insur that could reason be expect or intend by an insur to result in bodili injuri or properti damag even if the bodili injuri or properti damag a is of a differ kind qualiti or degre than expect or intend or b is sustain by a differ person or entiti than expect or intend,"under section ii we do not cover 
 a Bodily injury or property damage arise 
 out of 
 1 intentional 
 act 
 or 
 omission 
 commit by or at the direction of any 
 insured that could reasonably be 
 expect or intend by an insured to 
 result in bodily injury or property 
 damage even if the bodily injury or 
 property damage 
 a be of a different kind quality or 
 degree than expect or intend 
 or 
 b be sustain by a different person 
 or entity than expect or 
 intend"
"This applies whether or not the
insured forms the intent or has the
mental capacity to form the intent to
cause bodily injury or property
damage You are deemed to intend
the
natural
and
probable
consequences of your actions",this appli whether or not the insur form the intent or has the mental capac to form the intent to caus bodili injuri or properti damag you are deem to intend the natur and probabl consequ of your action,"this apply whether or not the 
 insure form the intent or have the 
 mental capacity to form the intent to 
 cause bodily injury or property 
 damage you be deem to intend 
 the 
 natural 
 and 
 probable 
 consequence of your action"
"This exclusion does not apply to bodily
injury resulting from the use of
reasonable force by any insured to
protect persons or property
2 Criminal acts or omissions whether
charged or not committed by or at the
direction of any insured that could
reasonably be expected to result in
bodily injury or property damage of
any kind and in any degree
3 Acts or omissions committed by or at
the direction of any insured while
under the influence of any drug",this exclus doe not appli to bodili injuri result from the use of reason forc by ani insur to protect person or properti 2 crimin act or omiss whether charg or not commit by or at the direct of ani insur that could reason be expect to result in bodili injuri or properti damag of ani kind and in ani degre 3 act or omiss commit by or at the direct of ani insur while under the influenc of ani drug,"this exclusion do not apply to bodily 
 injury result from the use of 
 reasonable force by any insured to 
 protect person or property 
 2 criminal act or omission whether 
 charge or not commit by or at the 
 direction of any insured that could 
 reasonably be expect to result in 
 bodily injury or property damage of 
 any kind and in any degree 
 3 act or omission commit by or at 
 the direction of any insure while 
 under the influence of any drug"
"This exclusion does not apply to any
acts or omissions committed while
under the influence of any prescription
drug legally dispensed in the USA
and taken under the lawful order of and
in compliance with the instructions of a
health care professional licensed in the
USA
b Bodily injury or property damage arising
out of any premises other than an insured
location owned by or rented or leased to
any insured
c Bodily injury or property damage arising
out of or in connection with any business
of any insured",this exclus doe not appli to ani act or omiss commit while under the influenc of ani prescript drug legal dispens in the usa and taken under the law order of and in complianc with the instruct of a health care profession licens in the usa b bodili injuri or properti damag aris out of ani premis other than an insur locat own by or rent or leas to ani insur c bodili injuri or properti damag aris out of or in connect with ani busi of ani insur,"this exclusion do not apply to any 
 act or omission commit while 
 under the influence of any prescription 
 drug legally dispense in the USA 
 and take under the lawful order of and 
 in compliance with the instruction of a 
 health care professional license in the 
 USA 
 b Bodily injury or property damage arise 
 out of any premise other than an insure 
 location own by or rent or lease to 
 any insure 
 c Bodily injury or property damage arise 
 out of or in connection with any business 
 of any insure"
"This exclusion does not apply
1 to the renting leasing or holding for
rental or lease of a residence of yours
on an occasional basis not exceeding
21 days during any one policy period
for the use only as a residence
2 to the renting leasing or holding for
rental or lease of a residence of yours
52",this exclus doe not appli 1 to the rent leas or hold for rental or leas of a resid of your on an occasion basi not exceed 21 day dure ani one polici period for the use onli as a resid 2 to the rent leas or hold for rental or leas of a resid of your 52,"this exclusion do not apply 
 1 to the renting leasing or hold for 
 rental or lease of a residence of yours 
 on an occasional basis not exceed 
 21 day during any one policy period 
 for the use only as a residence 
 2 to the renting leasing or hold for 
 rental or lease of a residence of yours 
 52"
"in part for the use as a residence by
no more than two roomers or boarders
or
3 to the renting leasing or holding for
rental or lease for use as a residence
of that part of your dwelling on the
residence premises that you do not
occupy This applies only if the
dwelling is a two family dwelling
d Bodily injury or property damage arising
out of the rendering of or failing to render
professional services
e Bodily injury or property damage arising
out of the manufacture sale delivery or
transfer of any drug by any person
f Bodily injury or property damage arising
out of the ownership maintenance use
loading or unloading of motorized
vehicles including trailers of any type
This exclusion does not apply to
1 trailers not towed by attached to or
carried on motorized vehicles
2 motorized vehicles
a designed to assist and used by the
physically handicapped if
i not subject to motorized
vehicle registration and
ii not designed constructed or
altered for travel on public
roads
b stored on an insured location and
inoperable
c used exclusively on an insured
location
d designed for recreational use off
public roads not subject to
motorized vehicle registration
and not owned by any insured
e motorized golf carts not licensed
and not required to be licensed for
highway use or
f off an insured location and the
motorized vehicle is
i designed as a toy vehicle for
use by children under thirteen
years of age",in part for the use as a resid by no more than two roomer or boarder or 3 to the rent leas or hold for rental or leas for use as a resid of that part of your dwell on the resid premis that you do not occupi this appli onli if the dwell is a two famili dwell d bodili injuri or properti damag aris out of the render of or fail to render profession servic e bodili injuri or properti damag aris out of the manufactur sale deliveri or transfer of ani drug by ani person f bodili injuri or properti damag aris out of the ownership mainten use load or unload of motor vehicl includ trailer of ani type this exclus doe not appli to 1 trailer not tow by attach to or carri on motor vehicl 2 motor vehicl a design to assist and use by the physic handicap if i not subject to motor vehicl registr and ii not design construct or alter for travel on public road b store on an insur locat and inoper c use exclus on an insur locat d design for recreat use off public road not subject to motor vehicl registr and not own by ani insur e motor golf cart not licens and not requir to be licens for highway use or f off an insur locat and the motor vehicl is i design as a toy vehicl for use by children under thirteen year of age,"in part for the use as a residence by 
 no more than two roomer or boarder 
 or 
 3 to the renting leasing or hold for 
 rental or lease for use as a residence 
 of that part of your dwelling on the 
 residence premise that you do not 
 occupy this apply only if the 
 dwelling be a two family dwell 
 d Bodily injury or property damage arise 
 out of the rendering of or fail to render 
 professional service 
 e Bodily injury or property damage arise 
 out of the manufacture sale delivery or 
 transfer of any drug by any person 
 f Bodily injury or property damage arise 
 out of the ownership maintenance use 
 loading or unloading of motorize 
 vehicle include trailer of any type 
 this exclusion do not apply to 
 1 trailer not tow by attach to or 
 carry on motorize vehicle 
 2 motorize vehicle 
 a design to assist and use by the 
 physically handicapped if 
 I not subject to motorize 
 vehicle registration and 
 ii not design construct or 
 alter for travel on public 
 road 
 b store on an insured location and 
 inoperable 
 c use exclusively on an insure 
 location 
 d design for recreational use off 
 public road not subject to 
 motorize vehicle registration 
 and not own by any insure 
 e motorize golf cart not license 
 and not require to be license for 
 highway use or 
 f off an insured location and the 
 motorize vehicle be 
 I design as a toy vehicle for 
 use by child under thirteen 
 year of age"
"ii powered by one or more
batteries and
iii not built or modified after
manufacture to exceed a
speed of five miles per hour on
level ground
g Bodily injury or property damage arising
out of the ownership maintenance use
loading or unloading of watercraft
1 exceeding 26 feet 5 inches in overall
length
2 powered by any inboard jetdrive or
inboardoutboard motor and owned by
rented or leased to any insured
3 powered by any inboard jetdrive or
inboardoutboard motor exceeding 50
horsepower and owned by rented or
leased to any insured or
4 powered by one or more outboard
motors with a total of 25 or more
horsepower and owned by rented or
leased to any insured",ii power by one or more batteri and iii not built or modifi after manufactur to exceed a speed of five mile per hour on level ground g bodili injuri or properti damag aris out of the ownership mainten use load or unload of watercraft 1 exceed 26 feet 5 inch in overal length 2 power by ani inboard jetdriv or inboardoutboard motor and own by rent or leas to ani insur 3 power by ani inboard jetdriv or inboardoutboard motor exceed 50 horsepow and own by rent or leas to ani insur or 4 power by one or more outboard motor with a total of 25 or more horsepow and own by rent or leas to ani insur,"ii power by one or more 
 battery and 
 iii not build or modify after 
 manufacture to exceed a 
 speed of five mile per hour on 
 level ground 
 g Bodily injury or property damage arise 
 out of the ownership maintenance use 
 loading or unloading of watercraft 
 1 exceed 26 foot 5 inch in overall 
 length 
 2 power by any inboard jetdrive or 
 inboardoutboard motor and own by 
 rent or lease to any insure 
 3 power by any inboard jetdrive or 
 inboardoutboard motor exceed 50 
 horsepower and own by rent or 
 lease to any insured or 
 4 power by one or more outboard 
 motor with a total of 25 or more 
 horsepower and own by rent or 
 lease to any insure"
"This exclusion does not apply while the
watercraft is on an insured location or
stored on land elsewhere
h Arising out of the ownership maintenance
use loading or unloading of an aircraft An
aircraft means any contrivance used or
designed for flight except model or hobby
aircraft not used or designed to carry
people or cargo
i Bodily injury or property damage arising
out of any insureds
1 entrustment to any other person
2 vicarious parental liability whether or
not imposed by law for the actions of a
child or minor relating to the operation
maintenance loading or unloading or
3 supervision of any other person in the
operation maintenance loading or
unloading
of any motorized vehicle including trailers
of any type or of any watercraft or aircraft
not covered under SECTION II",this exclus doe not appli while the watercraft is on an insur locat or store on land elsewher h aris out of the ownership mainten use load or unload of an aircraft an aircraft mean ani contriv use or design for flight except model or hobbi aircraft not use or design to carri peopl or cargo i bodili injuri or properti damag aris out of ani insur 1 entrust to ani other person 2 vicari parent liabil whether or not impos by law for the action of a child or minor relat to the oper mainten load or unload or 3 supervis of ani other person in the oper mainten load or unload of ani motor vehicl includ trailer of ani type or of ani watercraft or aircraft not cover under section ii,"this exclusion do not apply while the 
 watercraft be on an insured location or 
 store on land elsewhere 
 h arise out of the ownership maintenance 
 use loading or unloading of an aircraft an 
 aircraft mean any contrivance use or 
 design for flight except model or hobby 
 aircraft not use or design to carry 
 people or cargo 
 i Bodily injury or property damage arise 
 out of any insured 
 1 entrustment to any other person 
 2 vicarious parental liability whether or 
 not impose by law for the action of a 
 child or minor relate to the operation 
 maintenance loading or unloading or 
 3 supervision of any other person in the 
 operation maintenance loading or 
 unloading 
 of any motorized vehicle include trailer 
 of any type or of any watercraft or aircraft 
 not cover under SECTION ii"
"Caused directly or indirectly by war
including
the
following
and
any
consequence of any of the following
1 undeclared war civil war insurrection
rebellion or revolution
2 warlike act by a military force or military
personnel or
3 destruction seizure or use for a military
purpose
Discharge of a nuclear weapon will be
deemed a warlike act even if accidental
k Bodily injury or property damage arising
out of in connection with aggravated by
or consisting of pollutants
l Bodily injury or property damage arising
out of exposure to lead paint or other leadbased products
m Bodily injury or property damage arising
out of exposure to asbestos
n Bodily injury or property damage arising
out of the ownership of custody of or care
for the following pure or mixed breed dogs
1 Pit Bull also known as an American Pit
Bull Terrier an American Staffordshire
Terrier or a Staffordshire Bull Terrier
2 Rottweiler or
3 Canary Dog also known as a Presa
Canario or a Perro de Presa Canario
o Bodily injury arising out of the
transmission by any person of any disease
or of any organisms or agents capable of
causing such disease through
1 personal physical contact of any
person with any other person or
2 the transmission of any person’s body
fluids to any other person
p Bodily injury arising out of actual alleged
or threatened
1 sexual misconduct including but not
limited to sexual harassment sexual
abuse and sexual molestation
2 corporal punishment or
3 physical emotional or mental abuse
whether or not committed with the intent to
produce bodily injury",caus direct or indirect by war includ the follow and ani consequ of ani of the follow 1 undeclar war civil war insurrect rebellion or revolut 2 warlik act by a militari forc or militari personnel or 3 destruct seizur or use for a militari purpos discharg of a nuclear weapon will be deem a warlik act even if accident k bodili injuri or properti damag aris out of in connect with aggrav by or consist of pollut l bodili injuri or properti damag aris out of exposur to lead paint or other leadbas product m bodili injuri or properti damag aris out of exposur to asbesto n bodili injuri or properti damag aris out of the ownership of custodi of or care for the follow pure or mix breed dog 1 pit bull also known as an american pit bull terrier an american staffordshir terrier or a staffordshir bull terrier 2 rottweil or 3 canari dog also known as a presa canario or a perro de presa canario o bodili injuri aris out of the transmiss by ani person of ani diseas or of ani organ or agent capabl of caus such diseas through 1 person physic contact of ani person with ani other person or 2 the transmiss of ani person bodi fluid to ani other person p bodili injuri aris out of actual alleg or threaten 1 sexual misconduct includ but not limit to sexual harass sexual abus and sexual molest 2 corpor punish or 3 physic emot or mental abus whether or not commit with the intent to produc bodili injuri,"cause directly or indirectly by war 
 include 
 the 
 follow 
 and 
 any 
 consequence of any of the follow 
 1 undeclared war civil war insurrection 
 rebellion or revolution 
 2 warlike act by a military force or military 
 personnel or 
 3 destruction seizure or use for a military 
 purpose 
 discharge of a nuclear weapon will be 
 deem a warlike act even if accidental 
 k Bodily injury or property damage arise 
 out of in connection with aggravate by 
 or consist of pollutant 
 l Bodily injury or property damage arise 
 out of exposure to lead paint or other leadbase product 
 m bodily injury or property damage arise 
 out of exposure to asbestos 
 n Bodily injury or property damage arise 
 out of the ownership of custody of or care 
 for the follow pure or mixed breed dog 
 1 Pit Bull also know as an American Pit 
 Bull Terrier an American Staffordshire 
 Terrier or a Staffordshire Bull Terrier 
 2 rottweiler or 
 3 Canary Dog also know as a Presa 
 Canario or a Perro de Presa Canario 
 o bodily injury arise out of the 
 transmission by any person of any disease 
 or of any organism or agent capable of 
 cause such disease through 
 1 personal physical contact of any 
 person with any other person or 
 2 the transmission of any person ’s body 
 fluid to any other person 
 p Bodily injury arise out of actual allege 
 or threaten 
 1 sexual misconduct include but not 
 limit to sexual harassment sexual 
 abuse and sexual molestation 
 2 corporal punishment or 
 3 physical emotional or mental abuse 
 whether or not commit with the intent to 
 produce bodily injury"
