paragraph,stemmed,tokenized
"THIS
POLICY
BOOKLET
WITH
THE
DECLARATIONS
CERTIFICATE
AND
ENDORSEMENTS IF ANY ISSUED TO FORM A
PART THEREOF COMPLETES THIS POLICY",this polici booklet with the declar certif and endors if ani issu to form a part thereof complet this polici,"this 
 POLICY 
 BOOKLET 
 with 
 the 
 declaration 
 certificate 
 and 
 endorsement if any issued to form a 
 part THEREOF COMPLETES this policy"
"SECTION I – PROPERTY COVERAGES
COVERAGE A – DWELLING
COVERAGE B – OTHER STRUCTURES
COVERAGE C – PERSONAL PROPERTY
COVERAGE D – LOSS OF USE
What Property Is Covered – Coverage A and Coverage B
8
What Property Is Not Covered – Coverage A and Coverage B
8
What Property Is Covered – Coverage C
9
What Property Is Covered Subject to Individual Limit of Liability –
Coverage C
10
What Property Is Not Covered – Coverage C
12
What Property Is Covered – Coverage D
14
Other Coverages – Section I
16
What Losses Are Covered – Section I
27
What Losses Are Not Covered – Exclusions  Section I
27
Conditions – Section I
38",section i – properti coverag coverag a – dwell coverag b – other structur coverag c – person properti coverag d – loss of use what properti is cover – coverag a and coverag b 8 what properti is not cover – coverag a and coverag b 8 what properti is cover – coverag c 9 what properti is cover subject to individu limit of liabil – coverag c 10 what properti is not cover – coverag c 12 what properti is cover – coverag d 14 other coverag – section i 16 what loss are cover – section i 27 what loss are not cover – exclus section i 27 condit – section i 38,"section i – property coverage 
 coverage a – dwelling 
 coverage b – other STRUCTURES 
 COVERAGE c – personal property 
 COVERAGE d – loss of USE 
 what property be cover – coverage A and Coverage B 
 8 
 what property be not cover – coverage A and Coverage B 
 8 
 what property be cover – coverage c 
 9 
 what property be cover Subject to Individual Limit of Liability – 
 Coverage c 
 10 
 what property be not cover – coverage c 
 12 
 what property be cover – coverage d 
 14 
 other Coverages – section i 
 16 
 what loss be cover – section i 
 27 
 what loss be not cover – Exclusions   Section i 
 27 
 Conditions – Section I 
 38"
"SECTION II – LIABILITY COVERAGES
COVERAGE E – PERSONAL LIABILITY
COVERAGE F – MEDICAL PAYMENTS TO OTHERS",section ii – liabil coverag coverag e – person liabil coverag f – medic payment to other,"SECTION II – LIABILITY coverage 
 coverage e – PERSONAL LIABILITY 
 COVERAGE F – MEDICAL payment to other"
"What Losses Are Covered – Coverage E
What Losses Are Covered – Coverage F
What Losses Are Not Covered – Exclusions  Section II
Additional Payments – Section II
Conditions – Section II
SECTION III – GENERAL PROVISIONS
AAA Membership Requirement
Bankruptcy
Changes and Liberalization
Concealment or Misrepresentation
Inflation Guard
Policy Period
Statements in the Application For Insurance
Subrogation",what loss are cover – coverag e what loss are cover – coverag f what loss are not cover – exclus section ii addit payment – section ii condit – section ii section iii – general provis aaa membership requir bankruptci chang and liber conceal or misrepresent inflat guard polici period statement in the applic for insur subrog,"what loss be cover – coverage e 
 what loss be cover – coverage f 
 what loss be not cover – exclusion   Section II 
 additional Payments – Section ii 
 Conditions – Section ii 
 SECTION III – GENERAL provision 
 AAA Membership Requirement 
 Bankruptcy 
 Changes and liberalization 
 Concealment or misrepresentation 
 Inflation Guard 
 Policy Period 
 statement in the application for Insurance 
 subrogation"
"AGREEMENT
We will provide the insurance you have selected in
return for the premium due us and your compliance
with all policy provisions Your declarations page
shows the policy period the premises to which this
insurance applies the coverages and limits you have
chosen and your premium Insurance under this
policy is provided only for the coverages stated in the
declarations The declarations page is part of this
policy",agreement we will provid the insur you have select in return for the premium due us and your complianc with all polici provis your declar page show the polici period the premis to which this insur appli the coverag and limit you have chosen and your premium insur under this polici is provid onli for the coverag state in the declar the declar page is part of this polici,"AGREEMENT 
 we will provide the insurance you have select in 
 return for the premium due we and your compliance 
 with all policy provision your declaration page 
 show the policy period the premise to which this 
 insurance apply the coverage and limit you have 
 choose and your premium insurance under this 
 policy be provide only for the coverage state in the 
 declaration the declaration page be part of this 
 policy"
"Throughout this policy certain words and phrases
have a defined meaning when printed in bold type
We us or our means the Auto Club Family
Insurance Company",throughout this polici certain word and phrase have a defin mean when print in bold type we us or our mean the auto club famili insur compani,"throughout this policy certain word and phrase 
 have a define meaning when print in bold type 
 we we or our mean the Auto Club Family 
 Insurance company"
"You or your means any insured named in the
declarations If there is only one insured named in
the declarations and that insured is a natural person
you or your includes that person’s spouse if that
spouse lives in the same household on a regular
continuous and permanent basis",you or your mean ani insur name in the declar if there is onli one insur name in the declar and that insur is a natur person you or your includ that person spous if that spous live in the same household on a regular continu and perman basi,"you or your mean any insure name in the 
 declaration if there be only one insure name in 
 the declaration and that insure be a natural person 
 you or your include that person ’s spouse if that 
 spouse live in the same household on a regular 
 continuous and permanent basis"
"Actual cash value – means the amount it would cost
to repair or replace covered property at the time of
loss or damage with material of like kind and quality
subject to a deduction for physical deterioration
depreciation and obsolescence Actual cash value
applies to valuation of covered property regardless of
whether that property has sustained partial or total
loss or damage The actual cash value of the lost or
damaged property may be significantly less than its
replacement value
Bodily injury – means bodily harm bodily sickness
or bodily disease including death that results Bodily
injury does not include damages for mental anguish
emotional distress or similar damages unless such",actual cash valu – mean the amount it would cost to repair or replac cover properti at the time of loss or damag with materi of like kind and qualiti subject to a deduct for physic deterior depreci and obsolesc actual cash valu appli to valuat of cover properti regardless of whether that properti has sustain partial or total loss or damag the actual cash valu of the lost or damag properti may be signific less than it replac valu bodili injuri – mean bodili harm bodili sick or bodili diseas includ death that result bodili injuri doe not includ damag for mental anguish emot distress or similar damag unless such,"actual cash value – mean the amount it would cost 
 to repair or replace cover property at the time of 
 loss or damage with material of like kind and quality 
 subject to a deduction for physical deterioration 
 depreciation and obsolescence actual cash value 
 applie to valuation of covered property regardless of 
 whether that property have sustain partial or total 
 loss or damage the actual cash value of the lost or 
 damage property may be significantly less than its 
 replacement value 
 bodily injury – mean bodily harm bodily sickness 
 or bodily disease include death that result bodily 
 injury do not include damage for mental anguish 
 emotional distress or similar damage unless such"
"damages are directly caused by actual physical injury
to the person claiming damages
Business – means any full or part time activity from
which any insured may derive an economic benefit
regardless of profit or loss Business includes but is
not limited to commercial enterprise trade hobby
profession occupation or employment or the renting
leasing or holding for rental or lease of any part of
any premises by any insured
If an insured provides home day care services to a
person or persons other than insureds and receives
monetary or other compensation for such services
that activity is a business Mutual exchange of home
day care services however is not considered
compensation The rendering of home day care
services by an insured to a relative of an insured is
not considered a business",damag are direct caus by actual physic injuri to the person claim damag busi – mean ani full or part time activ from which ani insur may deriv an econom benefit regardless of profit or loss busi includ but is not limit to commerci enterpris trade hobbi profess occup or employ or the rent leas or hold for rental or leas of ani part of ani premis by ani insur if an insur provid home day care servic to a person or person other than insur and receiv monetari or other compens for such servic that activ is a busi mutual exchang of home day care servic howev is not consid compens the render of home day care servic by an insur to a relat of an insur is not consid a busi,"damage be directly cause by actual physical injury 
 to the person claim damage 
 business – mean any full or part time activity from 
 which any insure may derive an economic benefit 
 regardless of profit or loss business include but be 
 not limit to commercial enterprise trade hobby 
 profession occupation or employment or the rent 
 leasing or hold for rental or lease of any part of 
 any premise by any insure 
 if an insure provide home day care service to a 
 person or person other than insured and receive 
 monetary or other compensation for such service 
 that activity be a business mutual exchange of home 
 day care service however be not consider 
 compensation the rendering of home day care 
 service by an insured to a relative of an insure be 
 not consider a business"
"Depreciation  means the lessening of the economic
value of any property because of age wear and tear
or obsolescence",depreci mean the lessen of the econom valu of ani properti becaus of age wear and tear or obsolesc,"depreciation   mean the lessening of the economic 
 value of any property because of age wear and tear 
 or obsolescence"
"Drug  means any controlled substance as defined
by federal or state law Drug includes but is not
limited
to
cocaine
LSD
marijuana
methamphetamine and all narcotics",drug mean ani control substanc as defin by feder or state law drug includ but is not limit to cocain lsd marijuana methamphetamin and all narcot,"Drug   mean any control substance as define 
 by federal or state law drug include but be not 
 limit 
 to 
 cocaine 
 LSD 
 marijuana 
 methamphetamine and all narcotic"
"Computer hardware including any
a internal and external components
b peripheral devices and
c storage or recording media",comput hardwar includ ani a intern and extern compon b peripher devic and c storag or record media,"computer hardware include any 
 a internal and external component 
 b peripheral device and 
 c storage or recording medium"
"Fungi  means any type or form of fungus including
mold or mildew and any mycotoxins spores scents
or byproducts produced or released by fungi Under
SECTION II this does not include any fungi that are
are on or are contained in products or goods
intended for consumption",fungi mean ani type or form of fungus includ mold or mildew and ani mycotoxin spore scent or byproduct produc or releas by fungi under section ii this doe not includ ani fungi that are are on or are contain in product or good intend for consumpt,"Fungi   mean any type or form of fungus include 
 mold or mildew and any mycotoxin spore scent 
 or byproduct produce or release by fungus under 
 section ii this do not include any fungus that be 
 be on or be contain in product or good 
 intend for consumption"
"Insured  means you and people who live in the
residence premises on a regular continuous and
permanent basis who are
1",insur mean you and peopl who live in the resid premis on a regular continu and perman basi who are 1,"insure   mean you and people who live in the 
 residence premise on a regular continuous and 
 permanent basis who be 
 1"
"Any other person under the age of 21 who is in
the care of you or any person included under
1 above",ani other person under the age of 21 who is in the care of you or ani person includ under 1 abov,"any other person under the age of 21 who be in 
 the care of you or any person include under 
 1 above"
"With respect to animals or watercraft to which
this policy applies any person or organization
legally responsible for these animals or
watercraft which are owned by you or any
person included in 1 or 2 above A person or
organization using or having custody of these
animals or watercraft in the course of any
business or without permission of the owner is
not an insured",with respect to anim or watercraft to which this polici appli ani person or organ legal respons for these anim or watercraft which are own by you or ani person includ in 1 or 2 abov a person or organ use or have custodi of these anim or watercraft in the cours of ani busi or without permiss of the owner is not an insur,"with respect to animal or watercraft to which 
 this policy apply any person or organization 
 legally responsible for these animal or 
 watercraft which be own by you or any 
 person include in 1 or 2 above a person or 
 organization use or have custody of these 
 animal or watercraft in the course of any 
 business or without permission of the owner be 
 not an insure"
"With respect to any motorized vehicle to
which this policy applies
a any residence employee while engaged in
your employ or the employ of any person
included in 1 or 2 above or
b other persons using the motorized vehicle
on an insured location with your
expressed permission",with respect to ani motor vehicl to which this polici appli a ani resid employe while engag in your employ or the employ of ani person includ in 1 or 2 abov or b other person use the motor vehicl on an insur locat with your express permiss,"with respect to any motorize vehicle to 
 which this policy apply 
 a any residence employee while engage in 
 your employ or the employ of any person 
 include in 1 or 2 above or 
 b other person use the motorize vehicle 
 on an insured location with your 
 express permission"
"Insured location also means that part of any
other premises other structures and grounds
used by you as a residence and
a shown in the declarations or
b acquired by you during the current policy
period for your use as a residence",insur locat also mean that part of ani other premis other structur and ground use by you as a resid and a shown in the declar or b acquir by you dure the current polici period for your use as a resid,"insured location also mean that part of any 
 other premise other structure and ground 
 use by you as a residence and 
 a show in the declaration or 
 b acquire by you during the current policy 
 period for your use as a residence"
"Land owned by or rented or leased to any
insured on which a one or two family dwelling
is being constructed as a residence for any
insured",land own by or rent or leas to ani insur on which a one or two famili dwell is be construct as a resid for ani insur,"land own by or rent or lease to any 
 insure on which a one or two family dwell 
 be be construct as a residence for any 
 insure"
"Motorized vehicle  means a selfpropelled land or
amphibious vehicle regardless of method of surface
contact Motorized vehicle includes parts and
equipment",motor vehicl mean a selfpropel land or amphibi vehicl regardless of method of surfac contact motor vehicl includ part and equip,"motorize vehicle   mean a selfpropelle land or 
 amphibious vehicle regardless of method of surface 
 contact motorize vehicle include part and 
 equipment"
"Motorized vehicle registration  means any
licensing fees registration or other process that must
be completed with any governmental entity that is
required by any ordinance statute or regulation
Motorized vehicle registration is not limited to
registration of motorized vehicles for use on the
public highways and includes any and all fees
licensing andor registration of motorized vehicles
pursuant to applicable law",motor vehicl registr mean ani licens fee registr or other process that must be complet with ani government entiti that is requir by ani ordin statut or regul motor vehicl registr is not limit to registr of motor vehicl for use on the public highway and includ ani and all fee licens andor registr of motor vehicl pursuant to applic law,"motorize vehicle registration   mean any 
 licensing fee registration or other process that must 
 be complete with any governmental entity that be 
 require by any ordinance statute or regulation 
 motorize vehicle registration be not limit to 
 registration of motorize vehicle for use on the 
 public highway and include any and all fee 
 license andor registration of motorize vehicle 
 pursuant to applicable law"
"Occurrence  means an accident including
continuous or repeated injurious exposure to
essentially the same conditions which during the
policy period results in bodily injury or property
damage Occurrence does not include any claim
arising out of a breach of a contractual obligation
express or implied warranty or any negligent or
intentional misrepresentation relating to a contract or
express or implied warranty Continuous or repeated
injurious exposure to the same or similar conditions is
considered to be one occurrence",occurr mean an accid includ continu or repeat injuri exposur to essenti the same condit which dure the polici period result in bodili injuri or properti damag occurr doe not includ ani claim aris out of a breach of a contractu oblig express or impli warranti or ani neglig or intent misrepresent relat to a contract or express or impli warranti continu or repeat injuri exposur to the same or similar condit is consid to be one occurr,"Occurrence   mean an accident include 
 continuous or repeat injurious exposure to 
 essentially the same condition which during the 
 policy period result in bodily injury or property 
 damage Occurrence do not include any claim 
 arise out of a breach of a contractual obligation 
 express or imply warranty or any negligent or 
 intentional misrepresentation relate to a contract or 
 express or imply warranty Continuous or repeat 
 injurious exposure to the same or similar condition be 
 consider to be one occurrence"
"Personal injury  means injury during the policy
period which arises out of one or more of the
following
1",person injuri mean injuri dure the polici period which aris out of one or more of the follow 1,"personal injury   mean injury during the policy 
 period which arise out of one or more of the 
 follow 
 1"
"malicious prosecution provided all actions of
any insured or on behalf of any insured which
gave rise to the claim of malicious prosecution
occurred during the time that insured has been
continuously insured under this or any other
homeowners policy issued by us",malici prosecut provid all action of ani insur or on behalf of ani insur which gave rise to the claim of malici prosecut occur dure the time that insur has been continu insur under this or ani other homeown polici issu by us,"malicious prosecution provide all action of 
 any insured or on behalf of any insure which 
 give rise to the claim of malicious prosecution 
 occur during the time that insure have be 
 continuously insure under this or any other 
 homeowner policy issue by we"
"libel slander or defamation of character
provided the first publication or utterance which
gave rise to the claim of libel slander or
defamation of character was made by or on
behalf of any insured during the time that
insured has been continuously insured under
this or any other homeowners policy issued by
us or",libel slander or defam of charact provid the first public or utter which gave rise to the claim of libel slander or defam of charact was made by or on behalf of ani insur dure the time that insur has been continu insur under this or ani other homeown polici issu by us or,"libel slander or defamation of character 
 provide the first publication or utterance which 
 give rise to the claim of libel slander or 
 defamation of character be make by or on 
 behalf of any insure during the time that 
 insure have be continuously insure under 
 this or any other homeowner policy issue by 
 we or"
"Pollutants  means any solid liquid gaseous or
thermal irritant or contaminant arising from any
source whether industrial or otherwise including but
not limited to asbestos radon carbon monoxide gas
fuel oil gasoline lead and any products containing
lead PCB smoke vapor soot fumes acids alkalis
chemicals insecticides and waste Waste includes
materials to be recycled reconditioned or reclaimed",pollut mean ani solid liquid gaseous or thermal irrit or contamin aris from ani sourc whether industri or otherwis includ but not limit to asbesto radon carbon monoxid gas fuel oil gasolin lead and ani product contain lead pcb smoke vapor soot fume acid alkali chemic insecticid and wast wast includ materi to be recycl recondit or reclaim,"pollutant   mean any solid liquid gaseous or 
 thermal irritant or contaminant arise from any 
 source whether industrial or otherwise include but 
 not limit to asbestos radon carbon monoxide gas 
 fuel oil gasoline lead and any product contain 
 lead pcb smoke vapor soot fumes acids alkali 
 chemical insecticide and waste Waste include 
 material to be recycle recondition or reclaim"
"Property damage  means physical injury to or
destruction of tangible property including all resulting
loss of use of that property Property damage does
not include any amounts sought for pecuniary or
economic losses
Punitive damages  means amounts of money
awarded or imposed to punish deter or to make an
example of a wrongdoer and includes but is not
limited
to
exemplary
damages
andor
aggravatedaggravating circumstances damages",properti damag mean physic injuri to or destruct of tangibl properti includ all result loss of use of that properti properti damag doe not includ ani amount sought for pecuniari or econom loss punit damag mean amount of money award or impos to punish deter or to make an exampl of a wrongdoer and includ but is not limit to exemplari damag andor aggravatedaggrav circumst damag,"property damage   mean physical injury to or 
 destruction of tangible property include all result 
 loss of use of that property property damage do 
 not include any amount seek for pecuniary or 
 economic loss 
 punitive damage   mean amount of money 
 award or impose to punish deter or to make an 
 example of a wrongdoer and include but be not 
 limit 
 to 
 exemplary 
 damage 
 andor 
 aggravatedaggravate circumstance damage"
"whether imposed pursuant to common law statutes
ordinances or regulations
Remediation  means the reasonable and necessary
treatment containment removal or disposal of fungi
wet rot dry rot or bacteria including any costs
thereof Remediation also includes any testing to
detect measure or evaluate fungi wet rot dry rot or
bacteria
Replacement cost – means
1",whether impos pursuant to common law statut ordin or regul remedi mean the reason and necessari treatment contain remov or dispos of fungi wet rot dri rot or bacteria includ ani cost thereof remedi also includ ani test to detect measur or evalu fungi wet rot dri rot or bacteria replac cost – mean 1,"whether impose pursuant to common law statute 
 ordinance or regulation 
 Remediation   mean the reasonable and necessary 
 treatment containment removal or disposal of fungus 
 wet rot dry rot or bacteria include any cost 
 thereof Remediation also include any testing to 
 detect measure or evaluate fungus wet rot dry rot or 
 bacteria 
 Replacement cost – mean 
 1"
"With respect to buildings and structures that
are not buildings the lesser of the cost at the
time of the loss to repair or to replace covered
damaged or destroyed property
a at the residence premises
b for the same use and
c with materials of like or reasonably similar
kind and quality",with respect to build and structur that are not build the lesser of the cost at the time of the loss to repair or to replac cover damag or destroy properti a at the resid premis b for the same use and c with materi of like or reason similar kind and qualiti,"with respect to building and structure that 
 be not building the less of the cost at the 
 time of the loss to repair or to replace cover 
 damage or destroy property 
 a at the residence premise 
 b for the same use and 
 c with material of like or reasonably similar 
 kind and quality"
