paragraph,stemmed,tokenized,stemmed_and_tokenized
"The most we will pay for any one person as a result of any one
accident is shown on the Coverage Selections Page This is the most
we will pay as the result of a single accident no matter how many
autos or premiums are shown on the Coverage Selections Page
If someone covered under this Part is also entitled to Medical
Payments coverage under another auto policy issued to you or any
household member we will pay only our proportionate share If
someone covered under this Part is using an auto he or she does not
own at the time of the accident the owner’s automobile Medical
Payments insurance must pay its limit before we pay Then we will
pay up to the limit shown on your Coverage Selections Page for any
expenses not covered by that insurance
We will not pay benefits under this Part which duplicate payments
made under the Medical Payments coverage of any other auto policy
We must sell you limits of 5000 per person if you want to buy them
Higher limits may be purchased if agreed upon by you and us
However while an auto covered under this Part is being operated in a
prearranged or organized racing speed stunting or demolition contest
or activity or in practice or preparation for any such contest or activity
the most we will pay is the required minimum limits
Part 7
Collision",the most we will pay for ani one person as a result of ani one accid is shown on the coverag select page this is the most we will pay as the result of a singl accid no matter how mani auto or premium are shown on the coverag select page if someon cover under this part is also entitl to medic payment coverag under anoth auto polici issu to you or ani household member we will pay onli our proportion share if someon cover under this part is use an auto he or she doe not own at the time of the accid the owner automobil medic payment insur must pay it limit befor we pay then we will pay up to the limit shown on your coverag select page for ani expens not cover by that insur we will not pay benefit under this part which duplic payment made under the medic payment coverag of ani other auto polici we must sell you limit of 5000 per person if you want to buy them higher limit may be purchas if agre upon by you and us howev while an auto cover under this part is be oper in a prearrang or organ race speed stunt or demolit contest or activ or in practic or prepar for ani such contest or activ the most we will pay is the requir minimum limit part 7 collis,"the most we will pay for any one person as a result of any one 
 accident be show on the Coverage Selections Page this be the most 
 we will pay as the result of a single accident no matter how many 
 auto or premium be show on the Coverage Selections Page 
 if someone cover under this part be also entitle to medical 
 payment coverage under another auto policy issue to you or any 
 household member we will pay only our proportionate share if 
 someone cover under this part be use an auto he or she do not 
 own at the time of the accident the owner ’s automobile medical 
 Payments insurance must pay its limit before we pay then we will 
 pay up to the limit show on your Coverage Selections Page for any 
 expense not cover by that insurance 
 we will not pay benefit under this part which duplicate payment 
 make under the Medical Payments coverage of any other auto policy 
 we must sell you limit of 5000 per person if you want to buy they 
 high limit may be purchase if agree upon by you and we 
 however while an auto cover under this part be be operate in a 
 prearranged or organize racing speed stunting or demolition contest 
 or activity or in practice or preparation for any such contest or activity 
 the most we will pay be the require minimum limit 
 part 7 
 collision",the most we will pay for ani one person as a result of ani one accid be show on the coverag select page this be the most we will pay as the result of a singl accid no matter how mani auto or premium be show on the coverag select page if someon cover under this part be also entitl to medic payment coverag under anoth auto polici issu to you or ani household member we will pay onli our proportion share if someon cover under this part be use an auto he or she doe not own at the time of the accid the owner automobil medic payment insur must pay it limit befor we pay then we will pay up to the limit show on your coverag select page for ani expen not cover by that insur we will not pay benefit under this part which duplic payment make under the medic payment coverag of ani other auto polici we must sell you limit of 5000 per person if you want to buy they high limit may be purcha if agre upon by you and we howev while an auto cover under this part be be oper in a prearrang or organ race speed stunt or demolit contest or activ or in practic or prepar for ani such contest or activ the most we will pay be the requir minimum limit part 7 colli
"Under this Part we will pay for any direct and accidental damage to
your auto caused by a collision It does not matter who is at fault
We will also pay for collision damage to other private passenger
autos while being used by you or a household member with the
consent of the owner However we will not pay for damage to any
auto which is owned or regularly used by you or a household
member unless a premium for this Part is shown for that auto on the
Coverage Selections Page We will not pay if an accident occurs
while an auto covered under this Part is being operated in any
prearranged or organized racing speed stunting or demolition contest
or activity or in practice or preparation for any such contest or activity
We will pay for each loss up to the actual cash value of the auto
or any of its parts at the time of the collision If the repair of a
damaged part will impair the operational safety of the auto we will
replace the part In all cases we will subtract the deductible amount
you selected Unless you selected a different amount the law sets
your deductible at 500 Your deductible is shown on the Coverage
Selections Page
We will not pay for a collision loss for an accident which occurs while
your auto is being operated by a household member who is not
listed as an operator on this policy Payment is withheld when the",under this part we will pay for ani direct and accident damag to your auto caus by a collis it doe not matter who is at fault we will also pay for collis damag to other privat passeng auto while be use by you or a household member with the consent of the owner howev we will not pay for damag to ani auto which is own or regular use by you or a household member unless a premium for this part is shown for that auto on the coverag select page we will not pay if an accid occur while an auto cover under this part is be oper in ani prearrang or organ race speed stunt or demolit contest or activ or in practic or prepar for ani such contest or activ we will pay for each loss up to the actual cash valu of the auto or ani of it part at the time of the collis if the repair of a damag part will impair the oper safeti of the auto we will replac the part in all case we will subtract the deduct amount you select unless you select a differ amount the law set your deduct at 500 your deduct is shown on the coverag select page we will not pay for a collis loss for an accid which occur while your auto is be oper by a household member who is not list as an oper on this polici payment is withheld when the,"under this part we will pay for any direct and accidental damage to 
 your auto cause by a collision it do not matter who be at fault 
 we will also pay for collision damage to other private passenger 
 auto while be use by you or a household member with the 
 consent of the owner however we will not pay for damage to any 
 auto which be own or regularly use by you or a household 
 member unless a premium for this part be show for that auto on the 
 Coverage Selections Page we will not pay if an accident occur 
 while an auto cover under this part be be operate in any 
 prearranged or organize racing speed stunting or demolition contest 
 or activity or in practice or preparation for any such contest or activity 
 we will pay for each loss up to the actual cash value of the auto 
 or any of its part at the time of the collision if the repair of a 
 damage part will impair the operational safety of the auto we will 
 replace the part in all case we will subtract the deductible amount 
 you select unless you select a different amount the law set 
 your deductible at 500 your deductible be show on the Coverage 
 Selections Page 
 we will not pay for a collision loss for an accident which occur while 
 your auto be be operate by a household member who be not 
 list as an operator on this policy payment be withhold when the",under this part we will pay for ani direct and accident damag to your auto caus by a collis it doe not matter who be at fault we will also pay for colli damag to other privat passeng auto while be use by you or a household member with the consent of the owner howev we will not pay for damag to ani auto which be own or regular use by you or a household member unless a premium for this part be show for that auto on the coverag select page we will not pay if an accid occur while an auto cover under this part be be oper in ani prearrang or organ race speed stunt or demolit contest or activ or in practic or prepar for ani such contest or activ we will pay for each loss up to the actual cash valu of the auto or ani of it part at the time of the colli if the repair of a damag part will impair the oper safeti of the auto we will replac the part in all case we will subtract the deduct amount you select unless you select a differ amount the law set your deduct at 500 your deduct be show on the coverag select page we will not pay for a collis loss for an accid which occur while your auto be be oper by a household member who be not list as an oper on this polici payment be withhold when the
"household member if listed would require the payment of additional
premium on this policy because
1 the household member would be classified as an inexperienced
operator or
2 a higher rating step would be assigned under the Safe Driver
Insurance Plan
You must notify us within 60 days after a person who will operate your
auto becomes a household member if that person was not a
household member on the effective date of your policy In the same
manner you must notify us if a household member who will operate
your auto becomes a licensed operator
If we pay for the total loss of your auto we will suspend the Collision
Coverage for that auto until it passes a Motor Vehicle Inspection Test
Camper bodies are not covered under this Part unless specifically
shown on the Coverage Selections Page or by endorsement An
additional premium will be charged for insuring a camper body
If an auto covered under this Part is not owned by you at the time of
the accident the owner’s auto insurance must pay its limit before we
pay Then we will pay up to the limit shown on your Coverage
Selections Page for any damage not covered by that insurance less
the deductible amount you selected
Part 8
Under this Part we will pay in some situations for direct and acciLimited Collision dental damage to your auto caused by a collision We will also pay
in these situations for damage to other private passenger autos while
being used by you or a household member with the consent of the
owner However we will not pay for damage to any auto which is
owned or regularly used by you or a household member unless a
premium for this Part is shown for that auto on the Coverage
Selections Page We will not pay if an accident occurs while an auto
covered under this Part is being operated in any prearranged or
organized racing speed stunting or demolition contest or activity or in
practice or preparation for any such contest or activity
We will not pay for a loss for an accident which occurs while your
auto is being operated by a household member who is not listed as
an operator of this policy Payment is withheld when the household
member if listed would require the payment of additional premium on
this policy because
1 the household member would be classified as an inexperienced
operator or",household member if list would requir the payment of addit premium on this polici becaus 1 the household member would be classifi as an inexperienc oper or 2 a higher rate step would be assign under the safe driver insur plan you must notifi us within 60 day after a person who will oper your auto becom a household member if that person was not a household member on the effect date of your polici in the same manner you must notifi us if a household member who will oper your auto becom a licens oper if we pay for the total loss of your auto we will suspend the collis coverag for that auto until it pass a motor vehicl inspect test camper bodi are not cover under this part unless specif shown on the coverag select page or by endors an addit premium will be charg for insur a camper bodi if an auto cover under this part is not own by you at the time of the accid the owner auto insur must pay it limit befor we pay then we will pay up to the limit shown on your coverag select page for ani damag not cover by that insur less the deduct amount you select part 8 under this part we will pay in some situat for direct and accilimit collis dental damag to your auto caus by a collis we will also pay in these situat for damag to other privat passeng auto while be use by you or a household member with the consent of the owner howev we will not pay for damag to ani auto which is own or regular use by you or a household member unless a premium for this part is shown for that auto on the coverag select page we will not pay if an accid occur while an auto cover under this part is be oper in ani prearrang or organ race speed stunt or demolit contest or activ or in practic or prepar for ani such contest or activ we will not pay for a loss for an accid which occur while your auto is be oper by a household member who is not list as an oper of this polici payment is withheld when the household member if list would requir the payment of addit premium on this polici becaus 1 the household member would be classifi as an inexperienc oper or,"household member if list would require the payment of additional 
 premium on this policy because 
 1 the household member would be classify as an inexperienced 
 operator or 
 2 a high rating step would be assign under the Safe Driver 
 Insurance Plan 
 you must notify we within 60 day after a person who will operate your 
 auto become a household member if that person be not a 
 household member on the effective date of your policy in the same 
 manner you must notify we if a household member who will operate 
 your auto become a license operator 
 if we pay for the total loss of your auto we will suspend the Collision 
 Coverage for that auto until it pass a Motor Vehicle Inspection Test 
 Camper body be not cover under this part unless specifically 
 show on the Coverage Selections Page or by endorsement an 
 additional premium will be charge for insure a camper body 
 if an auto cover under this part be not own by you at the time of 
 the accident the owner ’s auto insurance must pay its limit before we 
 pay then we will pay up to the limit show on your Coverage 
 Selections Page for any damage not cover by that insurance less 
 the deductible amount you select 
 part 8 
 under this part we will pay in some situation for direct and accilimite collision dental damage to your auto cause by a collision we will also pay 
 in these situation for damage to other private passenger auto while 
 be use by you or a household member with the consent of the 
 owner however we will not pay for damage to any auto which be 
 own or regularly use by you or a household member unless a 
 premium for this part be show for that auto on the Coverage 
 Selections Page we will not pay if an accident occur while an auto 
 cover under this part be be operate in any prearranged or 
 organized racing speed stunting or demolition contest or activity or in 
 practice or preparation for any such contest or activity 
 we will not pay for a loss for an accident which occur while your 
 auto be be operate by a household member who be not list as 
 an operator of this policy payment be withhold when the household 
 member if list would require the payment of additional premium on 
 this policy because 
 1 the household member would be classify as an inexperienced 
 operator or",household member if list would requir the payment of addit premium on this polici becaus 1 the household member would be classifi as an inexperienc oper or 2 a high rate step would be assign under the safe driver insur plan you must notifi we within 60 day after a person who will oper your auto becom a household member if that person be not a household member on the effect date of your polici in the same manner you must notifi we if a household member who will oper your auto becom a licen oper if we pay for the total loss of your auto we will suspend the collis coverag for that auto until it pass a motor vehicl inspect test camper bodi be not cover under this part unless specif show on the coverag select page or by endor an addit premium will be charg for insur a camper bodi if an auto cover under this part be not own by you at the time of the accid the owner auto insur must pay it limit befor we pay then we will pay up to the limit show on your coverag select page for ani damag not cover by that insur less the deduct amount you select part 8 under this part we will pay in some situat for direct and accilimit colli dental damag to your auto caus by a colli we will also pay in these situat for damag to other privat passeng auto while be use by you or a household member with the consent of the owner howev we will not pay for damag to ani auto which be own or regular use by you or a household member unless a premium for this part be show for that auto on the coverag select page we will not pay if an accid occur while an auto cover under this part be be oper in ani prearrang or organ race speed stunt or demolit contest or activ or in practic or prepar for ani such contest or activ we will not pay for a loss for an accid which occur while your auto be be oper by a household member who be not list as an oper of this polici payment be withhold when the household member if list would requir the payment of addit premium on this polici becaus 1 the household member would be classifi as an inexperienc oper or
