paragraph,stemmed,tokenized,stemmed_and_tokenized
"Sometimes the company insuring the auto responsible
for an accident will deny coverage or become insolvent We consider
such an auto to be uninsured for purposes of this Part However we do
not consider an auto owned by a governmental unit or someone who is
legally selfinsured to be an uninsured auto
This Part is Compulsory You must have limits of 20000 per person
and 40000 per accident However you may want to buy more
protection If so we must sell you limits up to 35000 per person and
80000 per accident provided you have purchased at least these limits
for Part 5 Higher limits may be purchased if agreed upon by you and
by us
We will pay damages to or for
1 You while occupying your auto while occupying an auto you do
not own or if injured as a pedestrian
2 Any household member while occupying your auto while
occupying an auto not owned by you or if injured as a pedestrian If
there are two or more policies which provide coverage at the
same limits we will only pay our proportionate share We will not pay
damages to or for any household member who has a Massachusetts
auto policy of his or her own or who is covered by any Massachusetts
auto policy of another household member providing uninsured auto
insurance with higher limits
3 Anyone else while occupying your auto We will not pay damages
to or for anyone else who has a Massachusetts auto
policy of his or her own or who is covered by any Massachusetts auto
policy of another household member providing uninsured
auto insurance
4 Anyone else for damages he or she is entitled to recover because of
injury to a person covered under this Part
If you are injured while occupying your auto and you have two or
more autos insured with us with different limits we will only pay up to
the limits shown on your Coverage Selections Page for the auto you are
occupying when injured
If you are injured as a pedestrian or while occupying an auto you do
not own and you have two or more Massachusetts auto policies which
provide coverage at different limits the policy with the higher limits will
pay If there are two or more policies which provide coverage at the
same limits we will only pay our proportionate share
We will not pay damages to or for you if struck by or while occupying",sometim the compani insur the auto respons for an accid will deni coverag or becom insolv we consid such an auto to be uninsur for purpos of this part howev we do not consid an auto own by a government unit or someon who is legal selfinsur to be an uninsur auto this part is compulsori you must have limit of 20000 per person and 40000 per accid howev you may want to buy more protect if so we must sell you limit up to 35000 per person and 80000 per accid provid you have purchas at least these limit for part 5 higher limit may be purchas if agre upon by you and by us we will pay damag to or for 1 you while occupi your auto while occupi an auto you do not own or if injur as a pedestrian 2 ani household member while occupi your auto while occupi an auto not own by you or if injur as a pedestrian if there are two or more polici which provid coverag at the same limit we will onli pay our proportion share we will not pay damag to or for ani household member who has a massachusett auto polici of his or her own or who is cover by ani massachusett auto polici of anoth household member provid uninsur auto insur with higher limit 3 anyon els while occupi your auto we will not pay damag to or for anyon els who has a massachusett auto polici of his or her own or who is cover by ani massachusett auto polici of anoth household member provid uninsur auto insur 4 anyon els for damag he or she is entitl to recov becaus of injuri to a person cover under this part if you are injur while occupi your auto and you have two or more auto insur with us with differ limit we will onli pay up to the limit shown on your coverag select page for the auto you are occupi when injur if you are injur as a pedestrian or while occupi an auto you do not own and you have two or more massachusett auto polici which provid coverag at differ limit the polici with the higher limit will pay if there are two or more polici which provid coverag at the same limit we will onli pay our proportion share we will not pay damag to or for you if struck by or while occupi,"sometimes the company insure the auto responsible 
 for an accident will deny coverage or become insolvent we consider 
 such an auto to be uninsured for purpose of this Part however we do 
 not consider an auto own by a governmental unit or someone who be 
 legally selfinsure to be an uninsured auto 
 this part be Compulsory you must have limit of 20000 per person 
 and 40000 per accident however you may want to buy more 
 protection if so we must sell you limit up to 35000 per person and 
 80000 per accident provide you have purchase at least these limit 
 for Part 5 high limit may be purchase if agree upon by you and 
 by we 
 we will pay damage to or for 
 1 you while occupy your auto while occupy an auto you do 
 not own or if injure as a pedestrian 
 2 any household member while occupy your auto while 
 occupy an auto not own by you or if injure as a pedestrian if 
 there be two or more policy which provide coverage at the 
 same limit we will only pay our proportionate share we will not pay 
 damage to or for any household member who have a Massachusetts 
 auto policy of his or her own or who be cover by any Massachusetts 
 auto policy of another household member provide uninsured auto 
 insurance with high limit 
 3 anyone else while occupy your auto we will not pay damage 
 to or for anyone else who have a Massachusetts auto 
 policy of his or her own or who be cover by any Massachusetts auto 
 policy of another household member provide uninsured 
 auto insurance 
 4 anyone else for damage he or she be entitle to recover because of 
 injury to a person cover under this part 
 if you be injure while occupy your auto and you have two or 
 more auto insure with we with different limit we will only pay up to 
 the limit show on your Coverage Selections Page for the auto you be 
 occupy when injure 
 if you be injure as a pedestrian or while occupy an auto you do 
 not own and you have two or more Massachusetts auto policy which 
 provide coverage at different limit the policy with the high limit will 
 pay if there be two or more policy which provide coverage at the 
 same limit we will only pay our proportionate share 
 we will not pay damage to or for you if strike by or while occupy",sometim the compani insur the auto respon for an accid will deni coverag or becom insolv we consid such an auto to be uninsur for purpos of this part howev we do not consid an auto own by a government unit or someon who be legal selfinsur to be an uninsur auto this part be compulsori you must have limit of 20000 per person and 40000 per accid howev you may want to buy more protect if so we must sell you limit up to 35000 per person and 80000 per accid provid you have purcha at least these limit for part 5 high limit may be purcha if agre upon by you and by we we will pay damag to or for 1 you while occupi your auto while occupi an auto you do not own or if injur as a pedestrian 2 ani household member while occupi your auto while occupi an auto not own by you or if injur as a pedestrian if there be two or more polici which provid coverag at the same limit we will onli pay our proportion share we will not pay damag to or for ani household member who have a massachusett auto polici of his or her own or who be cover by ani massachusett auto polici of anoth household member provid uninsur auto insur with high limit 3 anyon el while occupi your auto we will not pay damag to or for anyon el who have a massachusett auto polici of his or her own or who be cover by ani massachusett auto polici of anoth household member provid uninsur auto insur 4 anyon el for damag he or she be entitl to recov becaus of injuri to a person cover under this part if you be injur while occupi your auto and you have two or more auto insur with we with differ limit we will onli pay up to the limit show on your coverag select page for the auto you be occupi when injur if you be injur as a pedestrian or while occupi an auto you do not own and you have two or more massachusett auto polici which provid coverag at differ limit the polici with the high limit will pay if there be two or more polici which provid coverag at the same limit we will onli pay our proportion share we will not pay damag to or for you if strike by or while occupi
"an auto you own and which does not have Massachusetts compulsory
auto insurance
Likewise we will not pay damages to or for any household member if
struck by or while occupying an auto owned by that household
member which does not have Massachusetts compulsory auto
insurance
The most we will pay for damages to or for anyone injured in the
following situations is 35000 per person and 80000 per accident or
the limits you purchased whichever is less
1 Anyone injured while occupying your auto while it is being used
as a public or livery conveyance This does not apply to the use of
your auto in a sharetheexpense car pool arrangement or in an
expense reimbursement program either as a volunteer or at work
2 Anyone injured while using an auto without the consent of the
owner
3 Anyone injured while an auto is being operated in any
prearranged or organized racing speed stunting or demolition contest
or activity or in practice or preparation for any such contest or activity
We will reduce the damages an injured person is entitled to recover
by
1 The amount recovered from any legally responsible person
provided the injured person is fully compensated for his or her
damages for bodily injury
2 The amount paid under a workers’ compensation law or similar
law
3 Any expenses that are payable or would have been payable
except for a deductible under the PIP coverage of this policy or any
other Massachusetts auto policy
We will pay the balance of the damages up to the limits shown for this
Part on your Coverage Selections Page
The determination as to whether an injured person is legally entitled to
recover damages from the legally responsible owner or operator will
be by agreement between us and the injured person The amount of
the damages if any will be determined in the same way Arbitration
will be used if no agreement can be reached However in no event
may a demand for arbitration constitute first notice of claim We must
be given sufficient notice of claim to conduct a reasonable
investigation and attempt settlement before arbitration can be filed",an auto you own and which doe not have massachusett compulsori auto insur likewis we will not pay damag to or for ani household member if struck by or while occupi an auto own by that household member which doe not have massachusett compulsori auto insur the most we will pay for damag to or for anyon injur in the follow situat is 35000 per person and 80000 per accid or the limit you purchas whichev is less 1 anyon injur while occupi your auto while it is be use as a public or liveri convey this doe not appli to the use of your auto in a sharetheexpens car pool arrang or in an expens reimburs program either as a volunt or at work 2 anyon injur while use an auto without the consent of the owner 3 anyon injur while an auto is be oper in ani prearrang or organ race speed stunt or demolit contest or activ or in practic or prepar for ani such contest or activ we will reduc the damag an injur person is entitl to recov by 1 the amount recov from ani legal respons person provid the injur person is fulli compens for his or her damag for bodili injuri 2 the amount paid under a worker compens law or similar law 3 ani expens that are payabl or would have been payabl except for a deduct under the pip coverag of this polici or ani other massachusett auto polici we will pay the balanc of the damag up to the limit shown for this part on your coverag select page the determin as to whether an injur person is legal entitl to recov damag from the legal respons owner or oper will be by agreement between us and the injur person the amount of the damag if ani will be determin in the same way arbitr will be use if no agreement can be reach howev in no event may a demand for arbitr constitut first notic of claim we must be given suffici notic of claim to conduct a reason investig and attempt settlement befor arbitr can be file,"an auto you own and which do not have Massachusetts compulsory 
 auto insurance 
 likewise we will not pay damage to or for any household member if 
 strike by or while occupy an auto own by that household 
 member which do not have Massachusetts compulsory auto 
 insurance 
 the most we will pay for damage to or for anyone injure in the 
 follow situation be 35000 per person and 80000 per accident or 
 the limit you purchase whichever be less 
 1 anyone injure while occupy your auto while it be be use 
 as a public or livery conveyance this do not apply to the use of 
 your auto in a sharetheexpense car pool arrangement or in an 
 expense reimbursement program either as a volunteer or at work 
 2 anyone injure while use an auto without the consent of the 
 owner 
 3 anyone injure while an auto be be operate in any 
 prearranged or organize racing speed stunting or demolition contest 
 or activity or in practice or preparation for any such contest or activity 
 we will reduce the damage an injure person be entitle to recover 
 by 
 1 the amount recover from any legally responsible person 
 provide the injure person be fully compensate for his or her 
 damage for bodily injury 
 2 the amount pay under a worker ’ compensation law or similar 
 law 
 3 any expense that be payable or would have be payable 
 except for a deductible under the PIP coverage of this policy or any 
 other Massachusetts auto policy 
 we will pay the balance of the damage up to the limit show for this 
 part on your Coverage Selections Page 
 the determination as to whether an injure person be legally entitle to 
 recover damage from the legally responsible owner or operator will 
 be by agreement between we and the injured person the amount of 
 the damage if any will be determine in the same way arbitration 
 will be use if no agreement can be reach however in no event 
 may a demand for arbitration constitute first notice of claim we must 
 be give sufficient notice of claim to conduct a reasonable 
 investigation and attempt settlement before arbitration can be file",an auto you own and which doe not have massachusett compulsori auto insur likewis we will not pay damag to or for ani household member if strike by or while occupi an auto own by that household member which doe not have massachusett compulsori auto insur the most we will pay for damag to or for anyon injur in the follow situat be 35000 per person and 80000 per accid or the limit you purcha whichev be less 1 anyon injur while occupi your auto while it be be use as a public or liveri convey this doe not appli to the use of your auto in a sharetheexpens car pool arrang or in an expen reimbur program either as a volunt or at work 2 anyon injur while use an auto without the consent of the owner 3 anyon injur while an auto be be oper in ani prearrang or organ race speed stunt or demolit contest or activ or in practic or prepar for ani such contest or activ we will reduc the damag an injur person be entitl to recov by 1 the amount recov from ani legal respon person provid the injur person be fulli compen for his or her damag for bodili injuri 2 the amount pay under a worker compen law or similar law 3 ani expen that be payabl or would have be payabl except for a deduct under the pip coverag of this polici or ani other massachusett auto polici we will pay the balanc of the damag up to the limit show for this part on your coverag select page the determin as to whether an injur person be legal entitl to recov damag from the legal respon owner or oper will be by agreement between we and the injur person the amount of the damag if ani will be determin in the same way arbitr will be use if no agreement can be reach howev in no event may a demand for arbitr constitut first notic of claim we must be give suffici notic of claim to conduct a reason investig and attempt settlement befor arbitr can be file
"If an injured person settles a claim as a result of an accident covered under this
Part we will pay that person only if the claim was settled with our consent We
will not be bound under this Part by any judgment resulting from a lawsuit
brought without our written consent We will not however unreasonably
withhold our consent
The most we will pay for injuries to one or more persons as a result of bodily
injury to any one person in any one accident is shown on the Coverage
Selections Page as the “per person” limit Subject to this limit the most we will
pay for injuries to two or more people as the result of bodily injury to two or more
people in any one accident is shown on the Coverage Selections Page as the
“per accident” limit This is the most we will pay as the result of a single accident
The limits of two or more autos or policies shall not be added to gether
combined or stacked to determine the limits of coverage available to anyone
covered under this Part regardless of the number of autos involved persons
covered claims made or premiums shown on the Coverage Selections Page
We will not make payments under this Part which duplicate payments under the
uninsured auto insurance of any other auto policy
The Part will not benefit any insurer or selfinsurer under a workers’
compensation law or any similar law
Part 4
Damage to
Someone Else’s
Property",if an injur person settl a claim as a result of an accid cover under this part we will pay that person onli if the claim was settl with our consent we will not be bound under this part by ani judgment result from a lawsuit brought without our written consent we will not howev unreason withhold our consent the most we will pay for injuri to one or more person as a result of bodili injuri to ani one person in ani one accid is shown on the coverag select page as the “per person” limit subject to this limit the most we will pay for injuri to two or more peopl as the result of bodili injuri to two or more peopl in ani one accid is shown on the coverag select page as the “per accident” limit this is the most we will pay as the result of a singl accid the limit of two or more auto or polici shall not be ad to gether combin or stack to determin the limit of coverag avail to anyon cover under this part regardless of the number of auto involv person cover claim made or premium shown on the coverag select page we will not make payment under this part which duplic payment under the uninsur auto insur of ani other auto polici the part will not benefit ani insur or selfinsur under a worker compens law or ani similar law part 4 damag to someon els properti,"if an injure person settle a claim as a result of an accident cover under this 
 part we will pay that person only if the claim be settle with our consent we 
 will not be bind under this part by any judgment result from a lawsuit 
 bring without our write consent we will not however unreasonably 
 withhold our consent 
 the most we will pay for injury to one or more person as a result of bodily 
 injury to any one person in any one accident be show on the Coverage 
 Selections Page as the "" per person "" limit Subject to this limit the most we will 
 pay for injury to two or more people as the result of bodily injury to two or more 
 people in any one accident be show on the Coverage Selections Page as the 
 "" per accident "" limit this be the most we will pay as the result of a single accident 
 the limit of two or more auto or policy shall not be add to gether 
 combine or stack to determine the limit of coverage available to anyone 
 cover under this part regardless of the number of auto involve person 
 cover claim make or premium show on the Coverage Selections Page 
 we will not make payment under this part which duplicate payment under the 
 uninsured auto insurance of any other auto policy 
 the part will not benefit any insurer or selfinsurer under a worker ’ 
 compensation law or any similar law 
 part 4 
 damage to 
 Someone Else ’ 
 property","if an injur person settl a claim as a result of an accid cover under this part we will pay that person onli if the claim be settl with our consent we will not be bind under this part by ani judgment result from a lawsuit bring without our write consent we will not howev unreason withhold our consent the most we will pay for injuri to one or more person as a result of bodili injuri to ani one person in ani one accid be show on the coverag select page as the "" per person "" limit subject to this limit the most we will pay for injuri to two or more peopl as the result of bodili injuri to two or more peopl in ani one accid be show on the coverag select page as the "" per accident "" limit this be the most we will pay as the result of a singl accid the limit of two or more auto or polici shall not be ad to gether combin or stack to determin the limit of coverag avail to anyon cover under this part regardless of the number of auto involv person cover claim make or premium show on the coverag select page we will not make payment under this part which duplic payment under the uninsur auto insur of ani other auto polici the part will not benefit ani insur or selfinsur under a worker compen law or ani similar law part 4 damag to someon els properti"
