paragraph,stemmed,tokenized,stemmed_and_tokenized
"2 The amount recovered from any legally responsible person provided the
injured person is fully compensated for his or her damages for bodily injury
3 The amount paid under a workers’ compensation law or similar law
4 Any expenses that are payable or would have been payable except for a
deductible under the PIP coverage of this policy or any other Massachusetts
auto policy
If only one person sustains bodily injury we will pay any unpaid damages up to
the difference between the total amount collected from the automobile bodily
injury liability insurance covering the legally responsible owners and operators of
all insured autos and the “per person” limit shown for this Part on your Coverage
Selections Page This is the most we will pay for injuries to one or more persons
as the result of bodily injury to any one person in any one accident
Subject to the “per person” limit if two or more people sustain bodily injury and
are entitled to coverage under this Part we will pay any unpaid damages up to
the difference between the automobile bodily injury liability insurance “per
accident” limit covering the legally responsible owners and operators and the “per
accident” limit shown for this Part on your Coverage Selections Page This is the
most we will pay for injuries to two or more people as the result of bodily injury to
two or more people in any one accident
The determination as to whether an injured person is legally entitled to recover
damages from the legally responsible owner or operator will be by agreement
between us and the injured person The amount of damages if any will be
determined in the same way Arbitration will be used if no agreement can be
reached However in no event may a demand for arbitration constitute first
notice of claim We must be given sufficient notice of claim to conduct a
reasonable investigation and attempt settlement before arbitration can be filed
If an injured person settles a claim as a result of an accident covered under this
Part we will pay that person only if the claim was settled with our consent We
will not be bound under this Part by any judgment resulting from a lawsuit
brought without our written consent We will not however unreasonably withhold
our consent
The limits of two or more autos or policies shall not be added together combined
or stacked to determine the limits of coverage available to anyone covered
under this Part regardless of the number of autos involved persons covered
claims made or premiums shown on the Coverage Selections Page
We will not make payments under this Part which duplicate payments under the
underinsured auto insurance of any other auto policy
This Part will not benefit any insurer or selfinsurer under a workers’
compensation law or any similar law",2 the amount recov from ani legal respons person provid the injur person is fulli compens for his or her damag for bodili injuri 3 the amount paid under a worker compens law or similar law 4 ani expens that are payabl or would have been payabl except for a deduct under the pip coverag of this polici or ani other massachusett auto polici if onli one person sustain bodili injuri we will pay ani unpaid damag up to the differ between the total amount collect from the automobil bodili injuri liabil insur cover the legal respons owner and oper of all insur auto and the “per person” limit shown for this part on your coverag select page this is the most we will pay for injuri to one or more person as the result of bodili injuri to ani one person in ani one accid subject to the “per person” limit if two or more peopl sustain bodili injuri and are entitl to coverag under this part we will pay ani unpaid damag up to the differ between the automobil bodili injuri liabil insur “per accident” limit cover the legal respons owner and oper and the “per accident” limit shown for this part on your coverag select page this is the most we will pay for injuri to two or more peopl as the result of bodili injuri to two or more peopl in ani one accid the determin as to whether an injur person is legal entitl to recov damag from the legal respons owner or oper will be by agreement between us and the injur person the amount of damag if ani will be determin in the same way arbitr will be use if no agreement can be reach howev in no event may a demand for arbitr constitut first notic of claim we must be given suffici notic of claim to conduct a reason investig and attempt settlement befor arbitr can be file if an injur person settl a claim as a result of an accid cover under this part we will pay that person onli if the claim was settl with our consent we will not be bound under this part by ani judgment result from a lawsuit brought without our written consent we will not howev unreason withhold our consent the limit of two or more auto or polici shall not be ad togeth combin or stack to determin the limit of coverag avail to anyon cover under this part regardless of the number of auto involv person cover claim made or premium shown on the coverag select page we will not make payment under this part which duplic payment under the underinsur auto insur of ani other auto polici this part will not benefit ani insur or selfinsur under a worker compens law or ani similar law,"2 the amount recover from any legally responsible person provide the 
 injure person be fully compensate for his or her damage for bodily injury 
 3 the amount pay under a worker ’ compensation law or similar law 
 4 any expense that be payable or would have be payable except for a 
 deductible under the PIP coverage of this policy or any other Massachusetts 
 auto policy 
 if only one person sustain bodily injury we will pay any unpaid damage up to 
 the difference between the total amount collect from the automobile bodily 
 injury liability insurance cover the legally responsible owner and operator of 
 all insure auto and the "" per person "" limit show for this part on your Coverage 
 Selections Page this be the most we will pay for injury to one or more person 
 as the result of bodily injury to any one person in any one accident 
 Subject to the "" per person "" limit if two or more people sustain bodily injury and 
 be entitle to coverage under this part we will pay any unpaid damage up to 
 the difference between the automobile bodily injury liability insurance "" per 
 accident "" limit cover the legally responsible owner and operator and the "" per 
 accident "" limit show for this part on your Coverage Selections Page this be the 
 most we will pay for injury to two or more people as the result of bodily injury to 
 two or more people in any one accident 
 the determination as to whether an injure person be legally entitle to recover 
 damage from the legally responsible owner or operator will be by agreement 
 between we and the injured person the amount of damage if any will be 
 determined in the same way arbitration will be use if no agreement can be 
 reach however in no event may a demand for arbitration constitute first 
 notice of claim we must be give sufficient notice of claim to conduct a 
 reasonable investigation and attempt settlement before arbitration can be file 
 if an injured person settle a claim as a result of an accident cover under this 
 part we will pay that person only if the claim be settle with our consent we 
 will not be bind under this part by any judgment result from a lawsuit 
 bring without our write consent we will not however unreasonably withhold 
 our consent 
 the limit of two or more auto or policy shall not be add together combine 
 or stack to determine the limit of coverage available to anyone cover 
 under this part regardless of the number of auto involve person cover 
 claim make or premium show on the Coverage Selections Page 
 we will not make payment under this part which duplicate payment under the 
 underinsured auto insurance of any other auto policy 
 this part will not benefit any insurer or selfinsurer under a worker ’ 
 compensation law or any similar law","2 the amount recov from ani legal respon person provid the injur person be fulli compen for his or her damag for bodili injuri 3 the amount pay under a worker compen law or similar law 4 ani expen that be payabl or would have be payabl except for a deduct under the pip coverag of this polici or ani other massachusett auto polici if onli one person sustain bodili injuri we will pay ani unpaid damag up to the differ between the total amount collect from the automobil bodili injuri liabil insur cover the legal respon owner and oper of all insur auto and the "" per person "" limit show for this part on your coverag select page this be the most we will pay for injuri to one or more person as the result of bodili injuri to ani one person in ani one accid subject to the "" per person "" limit if two or more peopl sustain bodili injuri and be entitl to coverag under this part we will pay ani unpaid damag up to the differ between the automobil bodili injuri liabil insur "" per accident "" limit cover the legal respon owner and oper and the "" per accident "" limit show for this part on your coverag select page this be the most we will pay for injuri to two or more peopl as the result of bodili injuri to two or more peopl in ani one accid the determin as to whether an injur person be legal entitl to recov damag from the legal respon owner or oper will be by agreement between we and the injur person the amount of damag if ani will be determin in the same way arbitr will be use if no agreement can be reach howev in no event may a demand for arbitr constitut first notic of claim we must be give suffici notic of claim to conduct a reason investig and attempt settlement befor arbitr can be file if an injur person settl a claim as a result of an accid cover under this part we will pay that person onli if the claim be settl with our consent we will not be bind under this part by ani judgment result from a lawsuit bring without our write consent we will not howev unreason withhold our consent the limit of two or more auto or polici shall not be ad togeth combin or stack to determin the limit of coverag avail to anyon cover under this part regardless of the number of auto involv person cover claim make or premium show on the coverag select page we will not make payment under this part which duplic payment under the underinsur auto insur of ani other auto polici this part will not benefit ani insur or selfinsur under a worker compen law or ani similar law"
"General Provisions
and Exclusions
This section of the policy contains general provisions which unless
otherwise noted apply to all your coverages It also describes
some situations in which policy benefits will not be paid",general provis and exclus this section of the polici contain general provis which unless otherwis note appli to all your coverag it also describ some situat in which polici benefit will not be paid,"General Provisions 
 and Exclusions 
 this section of the policy contain general provision which unless 
 otherwise note apply to all your coverage it also describe 
 some situation in which policy benefit will not be pay",general provis and exclus this section of the polici contain general provis which unless otherwis note appli to all your coverag it also describ some situat in which polici benefit will not be pay
"Compulsory Bodily Injury To Others Part 1 only covers accidents
in Massachusetts All the other Parts provide coverage for accidents and losses which happen in the United States or Canada We
consider United States territories and possessions and Puerto Rico
to be part of the United States We will pay for accidents and losses
which happen while your auto is being transported between ports
of the United States and Canada Your auto is not covered in any
other country",compulsori bodili injuri to other part 1 onli cover accid in massachusett all the other part provid coverag for accid and loss which happen in the unit state or canada we consid unit state territori and possess and puerto rico to be part of the unit state we will pay for accid and loss which happen while your auto is be transport between port of the unit state and canada your auto is not cover in ani other countri,"Compulsory Bodily Injury to Others part 1 only cover accident 
 in Massachusetts all the other Parts provide coverage for accident and loss which happen in the United States or Canada we 
 consider United States territory and possession and Puerto Rico 
 to be part of the United States we will pay for accident and loss 
 which happen while your auto be be transport between port 
 of the United States and Canada your auto be not cover in any 
 other country",compulsori bodili injuri to other part 1 onli cover accid in massachusett all the other part provid coverag for accid and loss which happen in the unit state or canada we consid unit state territori and possess and puerto rico to be part of the unit state we will pay for accid and loss which happen while your auto be be transport between port of the unit state and canada your auto be not cover in ani other countri
"2 Our Duty To
We have the right to defend any lawsuit brought against
Defend You And
anyone covered under this policy for damages which might be
Our Right To Settle payable under this policy We also have a duty to defend any such
lawsuit even if it is without merit but our duty to defend ends when
we tender or pay to any claimant or to a court of competent
jurisdiction with the court’s permission the maximum limits of
coverage under this policy We may end our duty to defend at any
time during the course of the lawsuit by tendering or paying the
maximum limits of coverage under the policy without the need for a
judgment or settlement of the lawsuit or a release by the claimant
We have the right to settle any claim or lawsuit as we see fit If any
person covered under this policy settles a claim without our consent we will not be bound by that settlement
3 Additional Costs We will pay in addition to the limits shown for Compulsory and
We Will Pay
Optional Bodily Injury To Others Parts 1 and 5 and Damage to
Someone Else’s Property Part 4
A Premiums on appeal bonds and premiums on bonds to release
attachments for an amount up to the applicable limits you selected
in any suit we defend
B Interest that accrues after judgment is entered in any suit we
defend We will not pay interest that accrues after we have offered
to pay up to the limits you selected
C Up to 40 a day for loss of earnings but not for loss of other
income to any person covered under this policy who attends hearings or trials at our request
D Other reasonable expenses incurred at our request",2 our duti to we have the right to defend ani lawsuit brought against defend you and anyon cover under this polici for damag which might be our right to settl payabl under this polici we also have a duti to defend ani such lawsuit even if it is without merit but our duti to defend end when we tender or pay to ani claimant or to a court of compet jurisdict with the court permiss the maximum limit of coverag under this polici we may end our duti to defend at ani time dure the cours of the lawsuit by tender or pay the maximum limit of coverag under the polici without the need for a judgment or settlement of the lawsuit or a releas by the claimant we have the right to settl ani claim or lawsuit as we see fit if ani person cover under this polici settl a claim without our consent we will not be bound by that settlement 3 addit cost we will pay in addit to the limit shown for compulsori and we will pay option bodili injuri to other part 1 and 5 and damag to someon els properti part 4 a premium on appeal bond and premium on bond to releas attach for an amount up to the applic limit you select in ani suit we defend b interest that accru after judgment is enter in ani suit we defend we will not pay interest that accru after we have offer to pay up to the limit you select c up to 40 a day for loss of earn but not for loss of other incom to ani person cover under this polici who attend hear or trial at our request d other reason expens incur at our request,"2 our duty to 
 we have the right to defend any lawsuit bring against 
 Defend you and 
 anyone cover under this policy for damage which might be 
 our right to settle payable under this policy we also have a duty to defend any such 
 lawsuit even if it be without merit but our duty to defend end when 
 we tender or pay to any claimant or to a court of competent 
 jurisdiction with the court ’s permission the maximum limit of 
 coverage under this policy we may end our duty to defend at any 
 time during the course of the lawsuit by tender or pay the 
 maximum limit of coverage under the policy without the need for a 
 judgment or settlement of the lawsuit or a release by the claimant 
 we have the right to settle any claim or lawsuit as we see fit if any 
 person cover under this policy settle a claim without our consent we will not be bind by that settlement 
 3 additional cost we will pay in addition to the limit show for Compulsory and 
 we will pay 
 Optional Bodily Injury to Others Parts 1 and 5 and damage to 
 someone Else ’s Property Part 4 
 a premium on appeal bond and premium on bond to release 
 attachment for an amount up to the applicable limit you select 
 in any suit we defend 
 B Interest that accrue after judgment be enter in any suit we 
 defend we will not pay interest that accrue after we have offer 
 to pay up to the limit you select 
 c up to 40 a day for loss of earning but not for loss of other 
 income to any person cover under this policy who attend hearing or trial at our request 
 d other reasonable expense incur at our request",2 our duti to we have the right to defend ani lawsuit bring against defend you and anyon cover under this polici for damag which might be our right to settl payabl under this polici we also have a duti to defend ani such lawsuit even if it be without merit but our duti to defend end when we tender or pay to ani claimant or to a court of compet jurisdict with the court permiss the maximum limit of coverag under this polici we may end our duti to defend at ani time dure the cour of the lawsuit by tender or pay the maximum limit of coverag under the polici without the need for a judgment or settlement of the lawsuit or a relea by the claimant we have the right to settl ani claim or lawsuit as we see fit if ani person cover under this polici settl a claim without our consent we will not be bind by that settlement 3 addit cost we will pay in addit to the limit show for compulsori and we will pay option bodili injuri to other part 1 and 5 and damag to someon els properti part 4 a premium on appeal bond and premium on bond to releas attach for an amount up to the applic limit you select in ani suit we defend b interest that accru after judgment be enter in ani suit we defend we will not pay interest that accru after we have offer to pay up to the limit you select c up to 40 a day for loss of earn but not for loss of other incom to ani person cover under this polici who attend hear or trial at our request d other reason expen incur at our request
"4 What Happens If you die we will continue coverage for the period of this policy for
If You Die
A Your spouse if a resident of your household at your death
B Any legal representative to the extent he or she is responsible
for maintenance or use of your auto
C Any person having proper temporary custody of your auto
5 Our Right
To Be Repaid",4 what happen if you die we will continu coverag for the period of this polici for if you die a your spous if a resid of your household at your death b ani legal repres to the extent he or she is respons for mainten or use of your auto c ani person have proper temporari custodi of your auto 5 our right to be repaid,"4 what happens if you die we will continue coverage for the period of this policy for 
 if you die 
 a your spouse if a resident of your household at your death 
 b any legal representative to the extent he or she be responsible 
 for maintenance or use of your auto 
 C any person have proper temporary custody of your auto 
 5 our right 
 to be repay",4 what happen if you die we will continu coverag for the period of this polici for if you die a your spous if a resid of your household at your death b ani legal repre to the extent he or she be respon for mainten or use of your auto c ani person have proper temporari custodi of your auto 5 our right to be repay
