paragraph,stemmed,tokenized,stemmed_and_tokenized
"THE COVERAGE LIMIT SHOWN ON THE POLICY
DECLARATIONS FOR
1 EACH PERSON IS THE MAXIMUM THAT WE
WILL PAY FOR DAMAGES ARISING OUT OF
BODILY INJURY TO ONE PERSON IN ANY ONE
MOTOR VEHICLE ACCIDENT INCLUDING
DAMAGES SUSTAINED BY ANYONE ELSE AS A
RESULT OF THAT BODILY INJURY",the coverag limit shown on the polici declar for 1 each person is the maximum that we will pay for damag aris out of bodili injuri to one person in ani one motor vehicl accid includ damag sustain by anyon els as a result of that bodili injuri,"the COVERAGE LIMIT show on the POLICY 
 DECLARATIONS for 
 1 each person be the MAXIMUM that WE 
 will pay for DAMAGES arise out of 
 BODILY injury to one person in any one 
 MOTOR VEHICLE accident include 
 DAMAGES sustained by anyone else as a 
 result of that BODILY injury",the coverag limit show on the polici declar for 1 each person be the maximum that we will pay for damag aris out of bodili injuri to one person in ani one motor vehicl accid includ damag sustain by anyon el as a result of that bodili injuri
"EACH ACCIDENT IS THE MAXIMUM THAT WE
WILL PAY FOR DAMAGES ARISING OUT OF
BODILY INJURY TO TWO OR MORE PERSONS
IN ANY ONE MOTOR VEHICLE ACCIDENT THIS
LIMIT IS SUBJECT TO THE LIMIT FOR EACH
PERSON",each accid is the maximum that we will pay for damag aris out of bodili injuri to two or more person in ani one motor vehicl accid this limit is subject to the limit for each person,"each accident be the MAXIMUM that WE 
 will pay for DAMAGES arise out of 
 BODILY injury to two or MORE person 
 in any one MOTOR VEHICLE accident this 
 LIMIT be subject to the LIMIT for EACH 
 person",each accid be the maximum that we will pay for damag aris out of bodili injuri to two or more person in ani one motor vehicl accid this limit be subject to the limit for each person
"Allstate Insurance Company
THESE LIMITS ARE THE MAXIMUM ALLSTATE
WILL PAY FOR ANY ONE MOTOR VEHICLE
ACCIDENT REGARDLESS OF THE NUMBER OF
1 CLAIMS MADE",allstat insur compani these limit are the maximum allstat will pay for ani one motor vehicl accid regardless of the number of 1 claim made,"Allstate Insurance Company 
 these limit be the MAXIMUM allstate 
 will pay for any one MOTOR vehicle 
 accident regardless of the number of 
 1 claim make",allstat insur compani these limit be the maximum allstat will pay for ani one motor vehicl accid regardless of the number of 1 claim make
"DAMAGES PAYABLE WILL BE REDUCED BY
1 ALL AMOUNTS PAID BY THE OWNER OR
OPERATOR OF THE UNINSURED AUTO OR
ANYONE ELSE RESPONSIBLE THIS INCLUDES
ALL SUMS PAID UNDER THE BODILY INJURY
LIABILITY COVERAGE OF THIS OR ANY OTHER
AUTO POLICY",damag payabl will be reduc by 1 all amount paid by the owner or oper of the uninsur auto or anyon els respons this includ all sum paid under the bodili injuri liabil coverag of this or ani other auto polici,"damages payable will be REDUCED by 
 1 all amounts pay by the OWNER OR 
 operator of the UNINSURED auto or 
 anyone else RESPONSIBLE this include 
 all sums pay under the BODILY injury 
 LIABILITY coverage of this OR any other 
 AUTO POLICY",damag payabl will be reduc by 1 all amount pay by the owner or oper of the uninsur auto or anyon els respon this includ all sum pay under the bodili injuri liabil coverag of this or ani other auto polici
"ALL AMOUNTS PAYABLE UNDER ANY
WORKERS COMPENSATION LAW DISABILITY
BENEFITS LAW OR SIMILAR LAW
AUTOMOBILE MEDICAL PAYMENTS OR ANY
SIMILAR AUTOMOBILE MEDICAL PAYMENTS
COVERAGE",all amount payabl under ani worker compens law disabl benefit law or similar law automobil medic payment or ani similar automobil medic payment coverag,"all amount payable under any 
 WORKERS compensation LAW DISABILITY 
 benefit law or similar LAW 
 AUTOMOBILE MEDICAL payment or any 
 similar AUTOMOBILE MEDICAL payment 
 coverage",all amount payabl under ani worker compen law disabl benefit law or similar law automobil medic payment or ani similar automobil medic payment coverag
"WE ARE NOT OBLIGATED TO MAKE ANY PAYMENT
FOR BODILY INJURY UNDER THIS COVERAGE
WHICH ARISES OUT OF THE USE OF AN
UNDERINSURED MOTOR VEHICLE UNTIL AFTER
THE LIMITS OF LIABILITY FOR ALL LIABILITY
PROTECTION IN EFFECT AND APPLICABLE AT THE
TIME OF THE ACCIDENT HAVE BEEN EXHAUSTED
BY PAYMENT OF JUDGMENTS OR SETTLEMENTS",we are not oblig to make ani payment for bodili injuri under this coverag which aris out of the use of an underinsur motor vehicl until after the limit of liabil for all liabil protect in effect and applic at the time of the accid have been exhaust by payment of judgment or settlement,"we be not obligate to make any payment 
 for BODILY INJURY under this coverage 
 which arise OUT of the USE of an 
 underinsured MOTOR vehicle until after 
 the limit of LIABILITY for all LIABILITY 
 PROTECTION in EFFECT and APPLICABLE at the 
 TIME of the accident have be exhaust 
 by payment of judgment or settlement",we be not oblig to make ani payment for bodili injuri under this coverag which ari out of the use of an underinsur motor vehicl until after the limit of liabil for all liabil protect in effect and applic at the time of the accid have be exhaust by payment of judgment or settlement
"NO MATTER HOW MANY AUTOS OR AUTO
POLICIES MAY BE INVOLVED WHETHER WRITTEN
BY ALLSTATE OR ANOTHER COMPANY",no matter how mani auto or auto polici may be involv whether written by allstat or anoth compani,"no matter how many auto or auto 
 policy may be involve whether WRITTEN 
 BY ALLSTATE or another company",no matter how mani auto or auto polici may be involv whether write by allstat or anoth compani
"Proof Of Claim Medical Reports
As soon as possible you or any other person making
claim must give us written proof of claim including
all details reasonably required by us to determine the
amounts payable We may also require any person
making claim to submit to questioning under oath
and sign the transcript
The insured person may be required to take medical
examinations by physicians selected by us as often
as we reasonably require The insured person or that
person’s representative must authorize us to obtain
medical reports and copies of records",proof of claim medic report as soon as possibl you or ani other person make claim must give us written proof of claim includ all detail reason requir by us to determin the amount payabl we may also requir ani person make claim to submit to question under oath and sign the transcript the insur person may be requir to take medic examin by physician select by us as often as we reason requir the insur person or that person repres must author us to obtain medic report and copi of record,"proof of Claim Medical Reports 
 as soon as possible you or any other person make 
 claim must give we write proof of claim include 
 all detail reasonably require by we to determine the 
 amount payable we may also require any person 
 making claim to submit to question under oath 
 and sign the transcript 
 the insure person may be require to take medical 
 examination by physician select by we as often 
 as we reasonably require the insured person or that 
 person ’s representative must authorize we to obtain 
 medical report and copy of record",proof of claim medic report as soon as possibl you or ani other person make claim must give we write proof of claim includ all detail reason requir by we to determin the amount payabl we may also requir ani person make claim to submit to question under oath and sign the transcript the insur person may be requir to take medic examin by physician select by we as often as we reason requir the insur person or that person repre must author we to obtain medic report and copi of record
"Assistance And Cooperation
We may require the insured person to take proper
action to preserve all rights to recover damages from
anyone responsible for the bodily injury",assist and cooper we may requir the insur person to take proper action to preserv all right to recov damag from anyon respons for the bodili injuri,"assistance and Cooperation 
 we may require the insured person to take proper 
 action to preserve all right to recover damage from 
 anyone responsible for the bodily injury",assist and cooper we may requir the insur person to take proper action to preserv all right to recov damag from anyon respon for the bodili injuri
"Trust Agreement
When we pay any person under this coverage
1 we are entitled to repayment of amounts paid by
us and related collection expenses out of the
proceeds of any settlement or judgment that
person recovers from any responsible party or
insurer",trust agreement when we pay ani person under this coverag 1 we are entitl to repay of amount paid by us and relat collect expens out of the proceed of ani settlement or judgment that person recov from ani respons parti or insur,"Trust Agreement 
 when we pay any person under this coverage 
 1 we be entitle to repayment of amount pay by 
 we and related collection expense out of the 
 proceed of any settlement or judgment that 
 person recover from any responsible party or 
 insurer",trust agreement when we pay ani person under this coverag 1 we be entitl to repay of amount pay by we and relat collect expen out of the proceed of ani settlement or judgment that person recov from ani respon parti or insur
"all rights of recovery against any responsible
party or insurer must be maintained and
preserved for our benefit",all right of recoveri against ani respons parti or insur must be maintain and preserv for our benefit,"all right of recovery against any responsible 
 party or insurer must be maintain and 
 preserve for our benefit",all right of recoveri against ani respon parti or insur must be maintain and preserv for our benefit
"insured persons if we ask must take proper
action in their name to recover damages from
any responsible party or insurer We will select
the attorney We will pay all related costs and
fees",insur person if we ask must take proper action in their name to recov damag from ani respons parti or insur we will select the attorney we will pay all relat cost and fee,"insured person if we ask must take proper 
 action in their name to recover damage from 
 any responsible party or insurer we will select 
 the attorney we will pay all relate cost and 
 fee",insur person if we ask must take proper action in their name to recov damag from ani respon parti or insur we will select the attorney we will pay all relat cost and fee
"IF THERE IS OTHER INSURANCE
IF THE INSURED PERSON WAS IN ON GETTING
INTO OR OUT OF A VEHICLE YOU DO NOT OWN
WHICH IS INSURED FOR THIS COVERAGE UNDER
ANOTHER POLICY THIS COVERAGE WILL BE
EXCESS THIS MEANS THAT WHEN THE INSURED
PERSON IS LEGALLY ENTITLED TO RECOVER
DAMAGES IN EXCESS OF THE OTHER POLICY
LIMIT WE WILL PAY UP TO YOUR POLICY LIMIT
BUT ONLY AFTER THE OTHER INSURANCE HAS
BEEN EXHAUSTED
IF MORE THAN ONE POLICY APPLIES TO THE
ACCIDENT ON A PRIMARY BASIS THE TOTAL
BENEFITS PAYABLE TO ANY ONE PERSON WILL
NOT EXCEED THE MAXIMUM BENEFITS PAYABLE
BY THE POLICY WITH THE HIGHEST LIMIT FOR
UNINSURED MOTORISTS COVERAGE WE WILL
BEAR OUR PROPORTIONATE SHARE WITH OTHER
UNINSURED MOTORISTS BENEFITS THIS APPLIES",if there is other insur if the insur person was in on get into or out of a vehicl you do not own which is insur for this coverag under anoth polici this coverag will be excess this mean that when the insur person is legal entitl to recov damag in excess of the other polici limit we will pay up to your polici limit but onli after the other insur has been exhaust if more than one polici appli to the accid on a primari basi the total benefit payabl to ani one person will not exceed the maximum benefit payabl by the polici with the highest limit for uninsur motorist coverag we will bear our proportion share with other uninsur motorist benefit this appli,"if there be other insurance 
 if the insured person be in on get 
 INTO or out of a vehicle you do not own 
 which be insure for this coverage under 
 another policy this coverage will be 
 EXCESS this mean that when the insured 
 person be LEGALLY entitle to RECOVER 
 DAMAGES in EXCESS of the other POLICY 
 LIMIT WE will pay up to your POLICY LIMIT 
 but only after the other insurance have 
 be exhaust 
 if MORE than one policy apply to the 
 accident on a PRIMARY basis the total 
 benefit payable to any one person will 
 not exceed the MAXIMUM benefit payable 
 by the POLICY with the HIGHEST LIMIT for 
 uninsured MOTORISTS COVERAGE WE will 
 bear our proportionate share with other 
 uninsured motorist benefit this apply",if there be other insur if the insur person be in on get into or out of a vehicl you do not own which be insur for this coverag under anoth polici this coverag will be excess this mean that when the insur person be legal entitl to recov damag in excess of the other polici limit we will pay up to your polici limit but onli after the other insur have be exhaust if more than one polici appli to the accid on a primari basi the total benefit payabl to ani one person will not exceed the maximum benefit payabl by the polici with the high limit for uninsur motorist coverag we will bear our proportion share with other uninsur motorist benefit this appli
"Payment Of Loss By Allstate
Any amount due is payable to the insured person to
the parent or guardian of an injured minor or to the
spouse of any insured person who dies However
we may pay any person or estate lawfully entitled to
recover the damages",payment of loss by allstat ani amount due is payabl to the insur person to the parent or guardian of an injur minor or to the spous of ani insur person who die howev we may pay ani person or estat law entitl to recov the damag,"payment of loss by Allstate 
 any amount due be payable to the insured person to 
 the parent or guardian of an injured minor or to the 
 spouse of any insured person who die however 
 we may pay any person or estate lawfully entitle to 
 recover the damage",payment of loss by allstat ani amount due be payabl to the insur person to the parent or guardian of an injur minor or to the spous of ani insur person who die howev we may pay ani person or estat law entitl to recov the damag
"Allstate Insurance Company
If We Cannot Agree
If the insured person and we don’t agree on that
person’s right to receive damages on any claim
involving an amount of 3000 or less the dispute will
be settled by arbitration",allstat insur compani if we cannot agre if the insur person and we don't agre on that person right to receiv damag on ani claim involv an amount of 3000 or less the disput will be settl by arbitr,"Allstate Insurance Company 
 if we can not agree 
 if the insured person and we do not agree on that 
 person ’s right to receive damage on any claim 
 involve an amount of 3000 or less the dispute will 
 be settle by arbitration",allstat insur compani if we can not agre if the insur person and we do not agre on that person right to receiv damag on ani claim involv an amount of 3000 or less the disput will be settl by arbitr
"If the insured person and we don’t agree on that
person’s right to receive damages on any claim
involving an amount over 3000 then upon the
mutual consent of the insured person and Allstate
the disagreement may be settled by arbitration The
insured person and we however must mutually
agree to arbitrate the disagreements If the insured
person and we do not agree to arbitrate then the
disagreement will be resolved in a court of competent
jurisdiction",if the insur person and we don't agre on that person right to receiv damag on ani claim involv an amount over 3000 then upon the mutual consent of the insur person and allstat the disagr may be settl by arbitr the insur person and we howev must mutual agre to arbitr the disagr if the insur person and we do not agre to arbitr then the disagr will be resolv in a court of compet jurisdict,"if the insured person and we do not agree on that 
 person ’s right to receive damage on any claim 
 involve an amount over 3000 then upon the 
 mutual consent of the insured person and Allstate 
 the disagreement may be settle by arbitration the 
 insured person and we however must mutually 
 agree to arbitrate the disagreement if the insure 
 person and we do not agree to arbitrate then the 
 disagreement will be resolve in a court of competent 
 jurisdiction",if the insur person and we do not agre on that person right to receiv damag on ani claim involv an amount over 3000 then upon the mutual consent of the insur person and allstat the disagr may be settl by arbitr the insur person and we howev must mutual agre to arbitr the disagr if the insur person and we do not agre to arbitr then the disagr will be resolv in a court of compet jurisdict
"Unless the insured person or we object arbitration
will take place under the rules of the American
Arbitration Association",unless the insur person or we object arbitr will take place under the rule of the american arbitr associ,"unless the insured person or we object arbitration 
 will take place under the rule of the american 
 Arbitration Association",unless the insur person or we object arbitr will take place under the rule of the american arbitr associ
"If either party objects to the use of the rules of the
American Arbitration Association the following
alternative method of arbitration will be used The
insured person will select one arbitrator and we will
select another The two arbitrators will select a third
If they can’t agree on a third arbitrator within 30 days
the judge of the court of record in the county of
jurisdiction where arbitration is pending will appoint
the third arbitrator The written decision of any two
arbitrators will determine the issues Local rules
governing evidence and procedure will apply The
insured person will pay the arbitrator that person
selects and we will pay the one we select The
expense of the third arbitrator and all other expenses
of arbitration will be shared equally However
attorney fees and fees paid to medical or other expert
witnesses are not considered arbitration expenses
and are to be paid by the party incurring them",if either parti object to the use of the rule of the american arbitr associ the follow altern method of arbitr will be use the insur person will select one arbitr and we will select anoth the two arbitr will select a third if they can't agre on a third arbitr within 30 day the judg of the court of record in the counti of jurisdict where arbitr is pend will appoint the third arbitr the written decis of ani two arbitr will determin the issu local rule govern evid and procedur will appli the insur person will pay the arbitr that person select and we will pay the one we select the expens of the third arbitr and all other expens of arbitr will be share equal howev attorney fee and fee paid to medic or other expert wit are not consid arbitr expens and are to be paid by the parti incur them,"if either party object to the use of the rule of the 
 American Arbitration Association the follow 
 alternative method of arbitration will be use the 
 insure person will select one arbitrator and we will 
 select another the two arbitrator will select a third 
 if they can not agree on a third arbitrator within 30 day 
 the judge of the court of record in the county of 
 jurisdiction where arbitration be pende will appoint 
 the third arbitrator the write decision of any two 
 arbitrator will determine the issue local rule 
 govern evidence and procedure will apply the 
 insure person will pay the arbitrator that person 
 select and we will pay the one we select the 
 expense of the third arbitrator and all other expense 
 of arbitration will be share equally however 
 attorney fee and fee pay to medical or other expert 
 witness be not consider arbitration expense 
 and be to be pay by the party incur they",if either parti object to the use of the rule of the american arbitr associ the follow altern method of arbitr will be use the insur person will select one arbitr and we will select anoth the two arbitr will select a third if they can not agre on a third arbitr within 30 day the judg of the court of record in the counti of jurisdict where arbitr be pend will appoint the third arbitr the write decis of ani two arbitr will determin the issu local rule govern evid and procedur will appli the insur person will pay the arbitr that person select and we will pay the one we select the expen of the third arbitr and all other expen of arbitr will be share equal howev attorney fee and fee pay to medic or other expert wit be not consid arbitr expen and be to be pay by the parti incur they
"Regardless of the method of arbitration either party
has a right to a trial on all issues in a court of
competent jurisdiction Costs including attorney
fees are to be paid by the party incurring them",regardless of the method of arbitr either parti has a right to a trial on all issu in a court of compet jurisdict cost includ attorney fee are to be paid by the parti incur them,"regardless of the method of arbitration either party 
 have a right to a trial on all issue in a court of 
 competent jurisdiction cost include attorney 
 fee be to be pay by the party incur they",regardless of the method of arbitr either parti have a right to a trial on all issu in a court of compet jurisdict cost includ attorney fee be to be pay by the parti incur they
"Part 6
Protection Against Loss To The
Auto
The following coverages apply when indicated on the
Policy Declarations Additional payments autos
insured definitions exclusions and other",part 6 protect against loss to the auto the follow coverag appli when indic on the polici declar addit payment auto insur definit exclus and other,"part 6 
 Protection against Loss to the 
 Auto 
 the follow coverage apply when indicate on the 
 Policy Declarations additional payment auto 
 insure definition exclusion and other",part 6 protect against loss to the auto the follow coverag appli when indic on the polici declar addit payment auto insur definit exclus and other
"COVERAGE DD
Auto Collision Insurance
Allstate will pay for direct and accidental loss to your
insured auto or a nonowned auto including insured
loss to an attached trailer from a collision with
another object or by upset of that auto or trailer The
deductible amount won’t be subtracted from the loss
payment in collisions involving your insured auto
and another auto insured by us",coverag dd auto collis insur allstat will pay for direct and accident loss to your insur auto or a nonown auto includ insur loss to an attach trailer from a collis with anoth object or by upset of that auto or trailer the deduct amount won't be subtract from the loss payment in collis involv your insur auto and anoth auto insur by us,"COVERAGE DD 
 Auto Collision Insurance 
 Allstate will pay for direct and accidental loss to your 
 insure auto or a nonowne auto include insure 
 loss to an attached trailer from a collision with 
 another object or by upset of that auto or trailer the 
 deductible amount will not be subtract from the loss 
 payment in collision involve your insure auto 
 and another auto insure by we",coverag dd auto collis insur allstat will pay for direct and accident loss to your insur auto or a nonown auto includ insur loss to an attach trailer from a colli with anoth object or by upset of that auto or trailer the deduct amount will not be subtract from the loss payment in colli involv your insur auto and anoth auto insur by we
"COVERAGE DE
Diminishing Deductible Auto Collision
Insurance
If the loss is 100 or more Allstate will pay for direct
and accidental loss to your insured auto or a
nonowned auto including insured loss to an
attached trailer from a collision with another object
or by upset of that auto or trailer No deductible
applies to losses in excess of 100
If the loss is between 50 and 100 you pay the
difference between the amount of loss and 100
We will pay the rest of the loss up to our limits of
liability
If the loss is 50 or less we will not make any
payment",coverag de diminish deduct auto collis insur if the loss is 100 or more allstat will pay for direct and accident loss to your insur auto or a nonown auto includ insur loss to an attach trailer from a collis with anoth object or by upset of that auto or trailer no deduct appli to loss in excess of 100 if the loss is between 50 and 100 you pay the differ between the amount of loss and 100 we will pay the rest of the loss up to our limit of liabil if the loss is 50 or less we will not make ani payment,"coverage de 
 Diminishing Deductible Auto Collision 
 insurance 
 if the loss be 100 or more Allstate will pay for direct 
 and accidental loss to your insured auto or a 
 nonowne auto include insure loss to an 
 attach trailer from a collision with another object 
 or by upset of that auto or trailer no deductible 
 applie to loss in excess of 100 
 if the loss be between 50 and 100 you pay the 
 difference between the amount of loss and 100 
 we will pay the rest of the loss up to our limit of 
 liability 
 if the loss be 50 or less we will not make any 
 payment",coverag de diminish deduct auto colli insur if the loss be 100 or more allstat will pay for direct and accident loss to your insur auto or a nonown auto includ insur loss to an attach trailer from a colli with anoth object or by upset of that auto or trailer no deduct appli to loss in excess of 100 if the loss be between 50 and 100 you pay the differ between the amount of loss and 100 we will pay the rest of the loss up to our limit of liabil if the loss be 50 or less we will not make ani payment
