paragraph,stemmed,tokenized,stemmed_and_tokenized
"Part 4
Automobile Disability Income
Protection
Coverage CW
Allstate will pay the weekly benefit shown on the
Policy Declarations if an insured person sustains
continuous total disability as a direct result of bodily
injury sickness or disease caused by an auto
accident The injury must be sustained while in on
getting into or out of or when struck as a pedestrian
by an auto trailer or semitrailer
Benefits will be paid only while the insured person is
alive and only if the disability
1 commences within 20 days of the date of the
accident and
2",part 4 automobil disabl incom protect coverag cw allstat will pay the week benefit shown on the polici declar if an insur person sustain continu total disabl as a direct result of bodili injuri sick or diseas caus by an auto accid the injuri must be sustain while in on get into or out of or when struck as a pedestrian by an auto trailer or semitrail benefit will be paid onli while the insur person is aliv and onli if the disabl 1 commenc within 20 day of the date of the accid and 2,"part 4 
 Automobile Disability Income 
 Protection 
 Coverage CW 
 Allstate will pay the weekly benefit show on the 
 Policy Declarations if an insured person sustain 
 continuous total disability as a direct result of bodily 
 injury sickness or disease cause by an auto 
 accident the injury must be sustain while in on 
 get into or out of or when strike as a pedestrian 
 by an auto trailer or semitrailer 
 benefit will be pay only while the insure person be 
 alive and only if the disability 
 1 commence within 20 day of the date of the 
 accident and 
 2",part 4 automobil disabl incom protect coverag cw allstat will pay the week benefit show on the polici declar if an insur person sustain continu total disabl as a direct result of bodili injuri sick or diseas caus by an auto accid the injuri must be sustain while in on get into or out of or when strike as a pedestrian by an auto trailer or semitrail benefit will be pay onli while the insur person be aliv and onli if the disabl 1 commenc within 20 day of the date of the accid and 2
"during the second and subsequent years after
commencement continuously prevents the
insured person from engaging in any occupation
or employment for wage or profit",dure the second and subsequ year after commenc continu prevent the insur person from engag in ani occup or employ for wage or profit,"during the second and subsequent year after 
 commencement continuously prevent the 
 insured person from engage in any occupation 
 or employment for wage or profit",dure the second and subsequ year after commenc continu prevent the insur person from engag in ani occup or employ for wage or profit
"Payment Of Benefits Autopsy
The benefit is payable to the deceased insured
person’s spouse The spouse must be a resident of
the same household as the insured person at the
time of the accident However if the deceased is a
minor the benefit is payable to either parent That
parent must be a resident of the same household as
the minor at the time of the accident In all other
cases the benefit is payable to the deceased insured
person’s estate",payment of benefit autopsi the benefit is payabl to the deceas insur person spous the spous must be a resid of the same household as the insur person at the time of the accid howev if the deceas is a minor the benefit is payabl to either parent that parent must be a resid of the same household as the minor at the time of the accid in all other case the benefit is payabl to the deceas insur person estat,"payment of Benefits Autopsy 
 the benefit be payable to the deceased insure 
 person ’s spouse the spouse must be a resident of 
 the same household as the insured person at the 
 time of the accident however if the deceased be a 
 minor the benefit be payable to either parent that 
 parent must be a resident of the same household as 
 the minor at the time of the accident in all other 
 case the benefit be payable to the deceased insure 
 person ’s estate",payment of benefit autopsi the benefit be payabl to the deceas insur person spous the spous must be a resid of the same household as the insur person at the time of the accid howev if the decea be a minor the benefit be payabl to either parent that parent must be a resid of the same household as the minor at the time of the accid in all other case the benefit be payabl to the deceas insur person estat
"during the first year after commencement
continuously prevents the insured person from
performing all duties pertaining to that person’s
occupation and",dure the first year after commenc continu prevent the insur person from perform all duti pertain to that person occup and,"during the first year after commencement 
 continuously prevent the insured person from 
 perform all duty pertain to that person ’ 
 occupation and",dure the first year after commenc continu prevent the insur person from perform all duti pertain to that person occup and
"Allstate has the right and must be given the
opportunity to make an autopsy where it is not
prohibited by law",allstat has the right and must be given the opportun to make an autopsi where it is not prohibit by law,"Allstate have the right and must be give the 
 opportunity to make an autopsy where it be not 
 prohibit by law",allstat have the right and must be give the opportun to make an autopsi where it be not prohibit by law
"Allstate We or Us  means the Allstate
Insurance Company or Allstate Indemnity
Company as shown on the Policy Declarations",allstat we or us mean the allstat insur compani or allstat indemn compani as shown on the polici declar,"Allstate We or Us   mean the Allstate 
 Insurance Company or Allstate Indemnity 
 Company as show on the Policy declaration",allstat we or we mean the allstat insur compani or allstat indemn compani as show on the polici declar
"The beneficiary’s consent is not required for
cancellation assignment change of beneficiary or
any other change under this coverage",the beneficiari consent is not requir for cancel assign chang of beneficiari or ani other chang under this coverag,"the beneficiary ’s consent be not require for 
 cancellation assignment change of beneficiary or 
 any other change under this coverage",the beneficiari consent be not requir for cancel assign chang of beneficiari or ani other chang under this coverag
"This coverage does not apply to disability
1 sustained in the course of an occupation by any
person while",this coverag doe not appli to disabl 1 sustain in the cours of an occup by ani person while,"this coverage do not apply to disability 
 1 sustain in the course of an occupation by any 
 person while",this coverag doe not appli to disabl 1 sustain in the cour of an occup by ani person while
"operating loading unloading assisting on
or performing any other duties related to the
use of a commercial auto or an auto hired
or rented to others for a charge
b repairing or servicing autos including any
related duties",oper load unload assist on or perform ani other duti relat to the use of a commerci auto or an auto hire or rent to other for a charg b repair or servic auto includ ani relat duti,"operating loading unloading assist on 
 or perform any other duty relate to the 
 use of a commercial auto or an auto hire 
 or rent to other for a charge 
 b repair or servicing auto include any 
 relate duty",oper load unload assist on or perform ani other duti relat to the use of a commerci auto or an auto hire or rent to other for a charg b repair or servic auto includ ani relat duti
"sustained while in on getting into or out of or
when struck as a pedestrian by
a a vehicle operated on rails or
crawlertreads
b a vehicle or other equipment designed for
use off public roads while not on public
roads or
c a vehicle when used as a residence or
premises",sustain while in on get into or out of or when struck as a pedestrian by a a vehicl oper on rail or crawlertread b a vehicl or other equip design for use off public road while not on public road or c a vehicl when use as a resid or premis,"sustain while in on get into or out of or 
 when strike as a pedestrian by 
 a a vehicle operate on rail or 
 crawlertread 
 b a vehicle or other equipment design for 
 use off public road while not on public 
 road or 
 c a vehicle when use as a residence or 
 premise",sustain while in on get into or out of or when strike as a pedestrian by a a vehicl oper on rail or crawlertread b a vehicl or other equip design for use off public road while not on public road or c a vehicl when use as a resid or premis
"Weekly benefits are payable to the disabled insured
person Accrued weekly benefits are payable every
four weeks Any remaining balance is payable at
termination of the disability period Benefits end
upon the death of the insured person",week benefit are payabl to the disabl insur person accru week benefit are payabl everi four week ani remain balanc is payabl at termin of the disabl period benefit end upon the death of the insur person,"weekly benefit be payable to the disabled insure 
 person accrue weekly benefit be payable every 
 four week any remain balance be payable at 
 termination of the disability period benefit end 
 upon the death of the insured person",week benefit be payabl to the disabl insur person accru week benefit be payabl everi four week ani remain balanc be payabl at termin of the disabl period benefit end upon the death of the insur person
"Proof Of Claim Medical Reports
As soon as possible any person making claim must
give us written proof of claim
The injured person may be required to take medical
examinations by physicians we choose as often as
we reasonably require We must be given
authorization to obtain medical reports and copies of
records pertinent to the claim",proof of claim medic report as soon as possibl ani person make claim must give us written proof of claim the injur person may be requir to take medic examin by physician we choos as often as we reason requir we must be given author to obtain medic report and copi of record pertin to the claim,"proof of Claim Medical Reports 
 as soon as possible any person make claim must 
 give we write proof of claim 
 the injure person may be require to take medical 
 examination by physician we choose as often as 
 we reasonably require we must be give 
 authorization to obtain medical report and copy of 
 record pertinent to the claim",proof of claim medic report as soon as possibl ani person make claim must give we write proof of claim the injur person may be requir to take medic examin by physician we choos as often as we reason requir we must be give author to obtain medic report and copi of record pertin to the claim
"Part 5
Uninsured Motorists Insurance
Coverage SS
We will pay damages because of bodily injury which
an insured person is legally entitled to recover from
the owner or operator of an uninsured auto Bodily
injury must be caused by accident and arise out of
the ownership maintenance or use of an uninsured
auto We will not pay any punitive or exemplary
damages",part 5 uninsur motorist insur coverag ss we will pay damag becaus of bodili injuri which an insur person is legal entitl to recov from the owner or oper of an uninsur auto bodili injuri must be caus by accid and aris out of the ownership mainten or use of an uninsur auto we will not pay ani punit or exemplari damag,"part 5 
 Uninsured Motorists Insurance 
 Coverage SS 
 we will pay damage because of bodily injury which 
 an insured person be legally entitle to recover from 
 the owner or operator of an uninsured auto bodily 
 injury must be cause by accident and arise out of 
 the ownership maintenance or use of an uninsured 
 auto we will not pay any punitive or exemplary 
 damage",part 5 uninsur motorist insur coverag ss we will pay damag becaus of bodili injuri which an insur person be legal entitl to recov from the owner or oper of an uninsur auto bodili injuri must be caus by accid and aris out of the ownership mainten or use of an uninsur auto we will not pay ani punit or exemplari damag
"The right to benefits and the amount payable will be
decided by agreement between the insured person
and Allstate If an agreement can’t be reached the
decision may be made by arbitration
If an insured person sues a person believed
responsible for the accident without giving us notice
so as to give us adequate time to intervene in a
lawsuit we aren’t bound by any resulting judgment",the right to benefit and the amount payabl will be decid by agreement between the insur person and allstat if an agreement can't be reach the decis may be made by arbitr if an insur person sue a person believ respons for the accid without give us notic so as to give us adequ time to interven in a lawsuit we aren't bound by ani result judgment,"the right to benefit and the amount payable will be 
 decide by agreement between the insured person 
 and Allstate if an agreement can not be reach the 
 decision may be make by arbitration 
 if an insured person sue a person believe 
 responsible for the accident without give we notice 
 so as to give we adequate time to intervene in a 
 lawsuit we be not bind by any result judgment",the right to benefit and the amount payabl will be decid by agreement between the insur person and allstat if an agreement can not be reach the decis may be make by arbitr if an insur person sue a person believ respon for the accid without give we notic so as to give we adequ time to interven in a lawsuit we be not bind by ani result judgment
"Any other person who is legally entitled to
recover because of bodily injury to you a
relative who resides in your household or an
occupant of your insured auto with your
permission",ani other person who is legal entitl to recov becaus of bodili injuri to you a relat who resid in your household or an occup of your insur auto with your permiss,"any other person who be legally entitle to 
 recover because of bodily injury to you a 
 relative who reside in your household or an 
 occupant of your insured auto with your 
 permission",ani other person who be legal entitl to recov becaus of bodili injuri to you a relat who resid in your household or an occup of your insur auto with your permiss
"you acquire ownership of during the policy
period This additional motor vehicle will be
covered if Allstate insures all other private
passenger motor vehicles you own You must
however notify Allstate within 60 days after you
acquire the motor vehicle and you must pay any
additional premium",you acquir ownership of dure the polici period this addit motor vehicl will be cover if allstat insur all other privat passeng motor vehicl you own you must howev notifi allstat within 60 day after you acquir the motor vehicl and you must pay ani addit premium,"you acquire ownership of during the policy 
 period this additional motor vehicle will be 
 cover if Allstate insure all other private 
 passenger motor vehicle you own you must 
 however notify Allstate within 60 day after you 
 acquire the motor vehicle and you must pay any 
 additional premium",you acquir ownership of dure the polici period this addit motor vehicl will be cover if allstat insur all other privat passeng motor vehicl you own you must howev notifi allstat within 60 day after you acquir the motor vehicl and you must pay ani addit premium
"not owned by you or a relative who resides in
your household being temporarily used while
your insured auto is being serviced or repaired
or if your insured auto is stolen or destroyed
The motor vehicle must be used with the
owner’s permission It can’t be furnished for the
regular use of you or any relative who resides in
your household",not own by you or a relat who resid in your household be temporarili use while your insur auto is be servic or repair or if your insur auto is stolen or destroy the motor vehicl must be use with the owner permiss it can't be furnish for the regular use of you or ani relat who resid in your household,"not own by you or a relative who reside in 
 your household be temporarily use while 
 your insure auto be be service or repair 
 or if your insure auto be steal or destroy 
 the motor vehicle must be use with the 
 owner ’s permission it can not be furnish for the 
 regular use of you or any relative who reside in 
 your household",not own by you or a relat who resid in your household be temporarili use while your insur auto be be servic or repair or if your insur auto be steal or destroy the motor vehicl must be use with the owner permiss it can not be furnish for the regular use of you or ani relat who resid in your household
"not owned by you or a relative who resides in
your household being operated by you with the
owner’s permission The motor vehicle can’t be
furnished for the regular use of you or any
relative who resides in your household",not own by you or a relat who resid in your household be oper by you with the owner permiss the motor vehicl can't be furnish for the regular use of you or ani relat who resid in your household,"not own by you or a relative who reside in 
 your household be operate by you with the 
 owner ’s permission the motor vehicle can not be 
 furnish for the regular use of you or any 
 relative who reside in your household",not own by you or a relat who resid in your household be oper by you with the owner permiss the motor vehicl can not be furnish for the regular use of you or ani relat who resid in your household
"a vehicle or other equipment designed for
use off public roads while not on public
roads
b a vehicle operated on rails or
crawlertreads or
c a vehicle when used as a residence or
premises",a vehicl or other equip design for use off public road while not on public road b a vehicl oper on rail or crawlertread or c a vehicl when use as a resid or premis,"a vehicle or other equipment design for 
 use off public road while not on public 
 road 
 b a vehicle operate on rail or 
 crawlertread or 
 c a vehicle when use as a residence or 
 premise",a vehicl or other equip design for use off public road while not on public road b a vehicl oper on rail or crawlertread or c a vehicl when use as a resid or premis
"a motor vehicle which has no bodily injury
liability bond or insurance policy in effect at the
time of the accident",a motor vehicl which has no bodili injuri liabil bond or insur polici in effect at the time of the accid,"a motor vehicle which have no bodily injury 
 liability bond or insurance policy in effect at the 
 time of the accident",a motor vehicl which have no bodili injuri liabil bond or insur polici in effect at the time of the accid
"a hitandrun motor vehicle which causes
bodily injury to an insured person by physical
contact with the insured person or with a vehicle
occupied by that person The identity of the
operator and the owner of the vehicle must be
unknown or cannot be found The accident
must be reported as soon as possible to the
proper authorities We must be notified within
30 days If the insured person was occupying a
vehicle at the time of the accident we have the
right to inspect it",a hitandrun motor vehicl which caus bodili injuri to an insur person by physic contact with the insur person or with a vehicl occupi by that person the ident of the oper and the owner of the vehicl must be unknown or cannot be found the accid must be report as soon as possibl to the proper author we must be notifi within 30 day if the insur person was occupi a vehicl at the time of the accid we have the right to inspect it,"a hitandrun motor vehicle which cause 
 bodily injury to an insured person by physical 
 contact with the insured person or with a vehicle 
 occupy by that person the identity of the 
 operator and the owner of the vehicle must be 
 unknown or can not be find the accident 
 must be report as soon as possible to the 
 proper authority we must be notify within 
 30 day if the insured person be occupy a 
 vehicle at the time of the accident we have the 
 right to inspect it",a hitandrun motor vehicl which caus bodili injuri to an insur person by physic contact with the insur person or with a vehicl occupi by that person the ident of the oper and the owner of the vehicl must be unknown or can not be find the accid must be report as soon as possibl to the proper author we must be notifi within 30 day if the insur person be occupi a vehicl at the time of the accid we have the right to inspect it
"Resident or Reside  means a person who
physically resides in your household with the
intention of continuing residence there Your
unmarried dependent children while temporarily
away from home will be considered residents if
they intend to resume residing in your
household",resid or resid mean a person who physic resid in your household with the intent of continu resid there your unmarri depend children while temporarili away from home will be consid resid if they intend to resum resid in your household,"Resident or Reside   mean a person who 
 physically reside in your household with the 
 intention of continue residence there your 
 unmarried dependent child while temporarily 
 away from home will be consider resident if 
 they intend to resume reside in your 
 household",resid or resid mean a person who physic resid in your household with the intent of continu resid there your unmarri depend child while temporarili away from home will be consid resid if they intend to resum resid in your household
"You or Your  means the insured person
named on the Policy Declarations and that
insured person’s resident spouse",you or your mean the insur person name on the polici declar and that insur person resid spous,"you or your   mean the insure person 
 name on the Policy Declarations and that 
 insure person ’s resident spouse",you or your mean the insur person name on the polici declar and that insur person resid spous
"an underinsured motor vehicle which has
liability protection in effect and applicable at the
time of the accident but less than the applicable
damages the insured person is legally entitled to
recover However an underinsured motor
vehicle is not an insured auto as defined under
this coverage",an underinsur motor vehicl which has liabil protect in effect and applic at the time of the accid but less than the applic damag the insur person is legal entitl to recov howev an underinsur motor vehicl is not an insur auto as defin under this coverag,"an underinsured motor vehicle which have 
 liability protection in effect and applicable at the 
 time of the accident but less than the applicable 
 damage the insured person be legally entitle to 
 recover however an underinsured motor 
 vehicle be not an insured auto as define under 
 this coverage",an underinsur motor vehicl which have liabil protect in effect and applic at the time of the accid but less than the applic damag the insur person be legal entitl to recov howev an underinsur motor vehicl be not an insur auto as defin under this coverag
"a motor vehicle for which no evidence of
financial responsibility is supplied to the
Department of Motor Vehicles within 60 days
after the accident occurs",a motor vehicl for which no evid of financi respons is suppli to the depart of motor vehicl within 60 day after the accid occur,"a motor vehicle for which no evidence of 
 financial responsibility be supply to the 
 Department of Motor Vehicles within 60 day 
 after the accident occur",a motor vehicl for which no evid of financi respon be suppli to the depart of motor vehicl within 60 day after the accid occur
"Exclusions  What is not covered
Allstate will not pay any damages an insured person
is legally entitled to recover because of
1 bodily injury to any person who makes a
settlement without our written consent
2",exclus what is not cover allstat will not pay ani damag an insur person is legal entitl to recov becaus of 1 bodili injuri to ani person who make a settlement without our written consent 2,"exclusion   what be not cover 
 Allstate will not pay any damage an insured person 
 be legally entitle to recover because of 
 1 bodily injury to any person who make a 
 settlement without our write consent 
 2",exclus what be not cover allstat will not pay ani damag an insur person be legal entitl to recov becaus of 1 bodili injuri to ani person who make a settlement without our write consent 2
"Allstate We Us or Our  means the
Allstate Insurance Company or Allstate
Indemnity Company as shown on the Policy
Declarations",allstat we us or our mean the allstat insur compani or allstat indemn compani as shown on the polici declar,"allstate we Us or our   mean the 
 Allstate Insurance Company or Allstate 
 Indemnity Company as show on the policy 
 declaration",allstat we we or our mean the allstat insur compani or allstat indemn compani as show on the polici declar
"bodily injury to anyone while in on getting into
or out of a motor vehicle you own which is
insured for this coverage under another policy
bodily injury if the payment would directly or
indirectly benefit any workers compensation or
disability benefits insurer including a self
insurer",bodili injuri to anyon while in on get into or out of a motor vehicl you own which is insur for this coverag under anoth polici bodili injuri if the payment would direct or indirect benefit ani worker compens or disabl benefit insur includ a self insur,"bodily injury to anyone while in on get into 
 or out of a motor vehicle you own which be 
 insure for this coverage under another policy 
 bodily injury if the payment would directly or 
 indirectly benefit any worker compensation or 
 disability benefit insurer include a self 
 insurer",bodili injuri to anyon while in on get into or out of a motor vehicl you own which be insur for this coverag under anoth polici bodili injuri if the payment would direct or indirect benefit ani worker compen or disabl benefit insur includ a self insur
